[{"tstamp":1673750940,"dia":"Sábado","fecha":"01/14/2023 09:35 pm","fijo":"825","suma":"136","corrido":"311","corrido1":"93","corrido2":"11","fireball":"2","draw":"Noche","createAt":"2023-01-15T02:49:00.859Z","updateAt":"2023-01-15T02:49:00.863Z","id":13180},{"tstamp":1673750940,"dia":"Sábado","fecha":"01/14/2023 09:35 pm","fijo":"825","suma":"136","corrido":"311","corrido1":"93","corrido2":"11","fireball":"2","draw":"Noche","createAt":"2023-01-15T02:49:00.859Z","updateAt":"2023-01-15T02:49:00.863Z","id":13180},{"tstamp":1673664660,"dia":"Viernes","fecha":"01/13/2023 09:35 pm","fijo":"406","suma":"543","corrido":"137","corrido1":"41","corrido2":"37","fireball":"0","draw":"Noche","createAt":"2023-01-14T02:51:00.763Z","updateAt":"2023-01-14T02:51:00.767Z","id":13178},{"tstamp":1673634840,"dia":"Viernes","fecha":"01/13/2023 01:20 pm","fijo":"396","suma":"796","corrido":"400","corrido1":"54","corrido2":"00","fireball":"2","draw":"Dia","createAt":"2023-01-13T18:34:00.690Z","updateAt":"2023-01-13T18:34:00.694Z","id":13177},{"tstamp":1673578260,"dia":"Jueves","fecha":"01/12/2023 09:35 pm","fijo":"892","suma":"174","corrido":"282","corrido1":"32","corrido2":"82","fireball":"2","draw":"Noche","createAt":"2023-01-13T02:51:00.821Z","updateAt":"2023-01-13T02:51:00.825Z","id":13176},{"tstamp":1673578260,"dia":"Jueves","fecha":"01/12/2023 09:35 pm","fijo":"892","suma":"174","corrido":"282","corrido1":"32","corrido2":"82","fireball":"2","draw":"Noche","createAt":"2023-01-13T02:51:00.821Z","updateAt":"2023-01-13T02:51:00.825Z","id":13176},{"tstamp":1673491860,"dia":"Miércoles","fecha":"01/11/2023 09:35 pm","fijo":"824","suma":"334","corrido":"510","corrido1":"05","corrido2":"10","fireball":"0","draw":"Noche","createAt":"2023-01-12T02:51:01.065Z","updateAt":"2023-01-12T02:51:01.069Z","id":13174},{"tstamp":1673462280,"dia":"Miércoles","fecha":"01/11/2023 01:20 pm","fijo":"898","suma":"491","corrido":"593","corrido1":"05","corrido2":"93","fireball":"1","draw":"Dia","createAt":"2023-01-11T18:38:00.677Z","updateAt":"2023-01-11T18:38:00.681Z","id":13173},{"tstamp":1673405340,"dia":"Martes","fecha":"01/10/2023 09:35 pm","fijo":"714","suma":"189","corrido":"475","corrido1":"24","corrido2":"75","fireball":"3","draw":"Noche","createAt":"2023-01-11T02:49:01.015Z","updateAt":"2023-01-11T02:49:01.019Z","id":13172},{"tstamp":1673405340,"dia":"Martes","fecha":"01/10/2023 09:35 pm","fijo":"714","suma":"189","corrido":"475","corrido1":"24","corrido2":"75","fireball":"3","draw":"Noche","createAt":"2023-01-11T02:49:01.015Z","updateAt":"2023-01-11T02:49:01.019Z","id":13172},{"tstamp":1673318941,"dia":"Lunes","fecha":"01/09/2023 09:35 pm","fijo":"417","suma":"962","corrido":"545","corrido1":"05","corrido2":"45","fireball":"8","draw":"Noche","createAt":"2023-01-10T02:49:01.940Z","updateAt":"2023-01-10T02:49:01.944Z","id":13170},{"tstamp":1673318941,"dia":"Lunes","fecha":"01/09/2023 09:35 pm","fijo":"417","suma":"962","corrido":"545","corrido1":"05","corrido2":"45","fireball":"8","draw":"Noche","createAt":"2023-01-10T02:49:01.940Z","updateAt":"2023-01-10T02:49:01.944Z","id":13170},{"tstamp":1673232540,"dia":"Domingo","fecha":"01/08/2023 09:35 pm","fijo":"663","suma":"883","corrido":"220","corrido1":"02","corrido2":"20","fireball":"5","draw":"Noche","createAt":"2023-01-09T02:49:01.031Z","updateAt":"2023-01-09T02:49:01.047Z","id":13168},{"tstamp":1673202840,"dia":"Domingo","fecha":"01/08/2023 01:20 pm","fijo":"792","suma":"394","corrido":"602","corrido1":"46","corrido2":"02","fireball":"6","draw":"Dia","createAt":"2023-01-08T18:34:00.301Z","updateAt":"2023-01-08T18:34:00.304Z","id":13167},{"tstamp":1673202840,"dia":"Domingo","fecha":"01/08/2023 01:20 pm","fijo":"792","suma":"394","corrido":"602","corrido1":"46","corrido2":"02","fireball":"6","draw":"Dia","createAt":"2023-01-08T18:34:00.301Z","updateAt":"2023-01-08T18:34:00.304Z","id":13167},{"tstamp":1673146261,"dia":"Sábado","fecha":"01/07/2023 09:35 pm","fijo":"749","suma":"013","corrido":"264","corrido1":"92","corrido2":"64","fireball":"7","draw":"Noche","createAt":"2023-01-08T02:51:01.387Z","updateAt":"2023-01-08T02:51:01.391Z","id":13166},{"tstamp":1673116560,"dia":"Sábado","fecha":"01/07/2023 01:20 pm","fijo":"150","suma":"816","corrido":"666","corrido1":"66","corrido2":"66","fireball":"7","draw":"Dia","createAt":"2023-01-07T18:36:00.908Z","updateAt":"2023-01-07T18:36:00.912Z","id":13165},{"tstamp":1673059860,"dia":"Viernes","fecha":"01/06/2023 09:35 pm","fijo":"571","suma":"007","corrido":"436","corrido1":"84","corrido2":"36","fireball":"6","draw":"Noche","createAt":"2023-01-07T02:51:00.632Z","updateAt":"2023-01-07T02:51:00.636Z","id":13164},{"tstamp":1673030040,"dia":"Viernes","fecha":"01/06/2023 01:20 pm","fijo":"442","suma":"388","corrido":"946","corrido1":"69","corrido2":"46","fireball":"9","draw":"Dia","createAt":"2023-01-06T18:34:00.620Z","updateAt":"2023-01-06T18:34:00.624Z","id":13163},{"tstamp":1672973461,"dia":"Jueves","fecha":"01/05/2023 09:35 pm","fijo":"063","suma":"312","corrido":"249","corrido1":"12","corrido2":"49","fireball":"9","draw":"Noche","createAt":"2023-01-06T02:51:01.442Z","updateAt":"2023-01-06T02:51:01.446Z","id":13162},{"tstamp":1672943640,"dia":"Jueves","fecha":"01/05/2023 01:20 pm","fijo":"717","suma":"591","corrido":"874","corrido1":"08","corrido2":"74","fireball":"3","draw":"Dia","createAt":"2023-01-05T18:34:00.457Z","updateAt":"2023-01-05T18:34:00.459Z","id":13161},{"tstamp":1672886941,"dia":"Miércoles","fecha":"01/04/2023 09:35 pm","fijo":"047","suma":"531","corrido":"484","corrido1":"14","corrido2":"84","fireball":"3","draw":"Noche","createAt":"2023-01-05T02:49:01.683Z","updateAt":"2023-01-05T02:49:01.686Z","id":13160},{"tstamp":1672857240,"dia":"Miércoles","fecha":"01/04/2023 01:20 pm","fijo":"857","suma":"451","corrido":"594","corrido1":"15","corrido2":"94","fireball":"6","draw":"Dia","createAt":"2023-01-04T18:34:01.159Z","updateAt":"2023-01-04T18:34:01.160Z","id":13159},{"tstamp":1672800661,"dia":"Martes","fecha":"01/03/2023 09:35 pm","fijo":"975","suma":"905","corrido":"930","corrido1":"39","corrido2":"30","fireball":"2","draw":"Noche","createAt":"2023-01-04T02:51:01.225Z","updateAt":"2023-01-04T02:51:01.226Z","id":13158},{"tstamp":1672770960,"dia":"Martes","fecha":"01/03/2023 01:20 pm","fijo":"003","suma":"74","corrido":"071","corrido1":"60","corrido2":"71","fireball":"6","draw":"Dia","createAt":"2023-01-03T18:36:01.942Z","updateAt":"2023-01-03T18:36:01.943Z","id":13157},{"tstamp":1672714140,"dia":"Lunes","fecha":"01/02/2023 09:35 pm","fijo":"490","suma":"793","corrido":"303","corrido1":"53","corrido2":"03","fireball":"6","draw":"Noche","createAt":"2023-01-03T02:49:00.489Z","updateAt":"2023-01-03T02:49:00.492Z","id":13156},{"tstamp":1672684440,"dia":"Lunes","fecha":"01/02/2023 01:20 pm","fijo":"851","suma":"853","corrido":"002","corrido1":"10","corrido2":"02","fireball":"8","draw":"Dia","createAt":"2023-01-02T18:34:00.760Z","updateAt":"2023-01-02T18:34:00.763Z","id":13155},{"tstamp":1672627740,"dia":"Domingo","fecha":"01/01/2023 09:35 pm","fijo":"964","suma":"792","corrido":"828","corrido1":"58","corrido2":"28","fireball":"8","draw":"Noche","createAt":"2023-01-02T02:49:00.672Z","updateAt":"2023-01-02T02:49:00.675Z","id":13154},{"tstamp":1672598161,"dia":"Domingo","fecha":"01/01/2023 01:20 pm","fijo":"011","suma":"229","corrido":"218","corrido1":"42","corrido2":"18","fireball":"4","draw":"Dia","createAt":"2023-01-01T18:36:01.281Z","updateAt":"2023-01-01T18:36:01.285Z","id":13153},{"tstamp":1672541461,"dia":"Sábado","fecha":"12/31/2022 09:35 pm","fijo":"090","suma":"806","corrido":"716","corrido1":"97","corrido2":"16","fireball":"1","draw":"Noche","createAt":"2023-01-01T02:51:01.213Z","updateAt":"2023-01-01T02:51:01.216Z","id":13152},{"tstamp":1672511760,"dia":"Sábado","fecha":"12/31/2022 01:20 pm","fijo":"239","suma":"935","corrido":"696","corrido1":"26","corrido2":"96","fireball":"5","draw":"Dia","createAt":"2022-12-31T18:36:01.260Z","updateAt":"2022-12-31T18:36:01.263Z","id":13151},{"tstamp":1672455060,"dia":"Viernes","fecha":"12/30/2022 09:35 pm","fijo":"185","suma":"115","corrido":"930","corrido1":"29","corrido2":"30","fireball":"1","draw":"Noche","createAt":"2022-12-31T02:51:01.026Z","updateAt":"2022-12-31T02:51:01.029Z","id":13150},{"tstamp":1672425241,"dia":"Viernes","fecha":"12/30/2022 01:20 pm","fijo":"515","suma":"537","corrido":"022","corrido1":"70","corrido2":"22","fireball":"4","draw":"Dia","createAt":"2022-12-30T18:34:01.227Z","updateAt":"2022-12-30T18:34:01.228Z","id":13149},{"tstamp":1672368540,"dia":"Jueves","fecha":"12/29/2022 09:35 pm","fijo":"048","suma":"045","corrido":"997","corrido1":"39","corrido2":"97","fireball":"5","draw":"Noche","createAt":"2022-12-30T02:49:00.588Z","updateAt":"2022-12-30T02:49:00.589Z","id":13148},{"tstamp":1672338960,"dia":"Jueves","fecha":"12/29/2022 01:20 pm","fijo":"210","suma":"937","corrido":"727","corrido1":"67","corrido2":"27","fireball":"6","draw":"Dia","createAt":"2022-12-29T18:36:00.880Z","updateAt":"2022-12-29T18:36:00.881Z","id":13147},{"tstamp":1672285895,"dia":"Miércoles","fecha":"12/28/2022 09:35 pm","fijo":"342","suma":"629","corrido":"287","corrido1":"52","corrido2":"87","fireball":"3","draw":"Noche","createAt":"2022-12-29T03:51:35.871Z","updateAt":"2022-12-29T03:51:35.874Z","id":13146},{"tstamp":1672252561,"dia":"Miércoles","fecha":"12/28/2022 01:20 pm","fijo":"921","suma":"458","corrido":"537","corrido1":"65","corrido2":"37","fireball":"4","draw":"Dia","createAt":"2022-12-28T18:36:01.379Z","updateAt":"2022-12-28T18:36:01.383Z","id":13145},{"tstamp":1672195740,"dia":"Martes","fecha":"12/27/2022 09:35 pm","fijo":"320","suma":"828","corrido":"508","corrido1":"45","corrido2":"08","fireball":"8","draw":"Noche","createAt":"2022-12-28T02:49:01.009Z","updateAt":"2022-12-28T02:49:01.012Z","id":13144},{"tstamp":1672166040,"dia":"Martes","fecha":"12/27/2022 01:20 pm","fijo":"542","suma":"669","corrido":"127","corrido1":"61","corrido2":"27","fireball":"8","draw":"Dia","createAt":"2022-12-27T18:34:00.762Z","updateAt":"2022-12-27T18:34:00.765Z","id":13143},{"tstamp":1672109340,"dia":"Lunes","fecha":"12/26/2022 09:35 pm","fijo":"836","suma":"105","corrido":"269","corrido1":"22","corrido2":"69","fireball":"0","draw":"Noche","createAt":"2022-12-27T02:49:01.179Z","updateAt":"2022-12-27T02:49:01.182Z","id":13142},{"tstamp":1672079640,"dia":"Lunes","fecha":"12/26/2022 01:20 pm","fijo":"465","suma":"782","corrido":"317","corrido1":"83","corrido2":"17","fireball":"5","draw":"Dia","createAt":"2022-12-26T18:34:01.057Z","updateAt":"2022-12-26T18:34:01.060Z","id":13141},{"tstamp":1672022940,"dia":"Domingo","fecha":"12/25/2022 09:35 pm","fijo":"823","suma":"595","corrido":"772","corrido1":"37","corrido2":"72","fireball":"2","draw":"Noche","createAt":"2022-12-26T02:49:00.931Z","updateAt":"2022-12-26T02:49:00.932Z","id":13140},{"tstamp":1671993240,"dia":"Domingo","fecha":"12/25/2022 01:20 pm","fijo":"770","suma":"968","corrido":"198","corrido1":"11","corrido2":"98","fireball":"3","draw":"Dia","createAt":"2022-12-25T18:34:00.844Z","updateAt":"2022-12-25T18:34:00.845Z","id":13139},{"tstamp":1671936540,"dia":"Sábado","fecha":"12/24/2022 09:35 pm","fijo":"337","suma":"837","corrido":"500","corrido1":"75","corrido2":"00","fireball":"0","draw":"Noche","createAt":"2022-12-25T02:49:00.550Z","updateAt":"2022-12-25T02:49:00.553Z","id":13138},{"tstamp":1671906961,"dia":"Sábado","fecha":"12/24/2022 01:20 pm","fijo":"487","suma":"874","corrido":"387","corrido1":"23","corrido2":"87","fireball":"7","draw":"Dia","createAt":"2022-12-24T18:36:01.223Z","updateAt":"2022-12-24T18:36:01.226Z","id":13137},{"tstamp":1671850140,"dia":"Viernes","fecha":"12/23/2022 09:35 pm","fijo":"276","suma":"023","corrido":"747","corrido1":"17","corrido2":"47","fireball":"7","draw":"Noche","createAt":"2022-12-24T02:49:00.853Z","updateAt":"2022-12-24T02:49:00.856Z","id":13136},{"tstamp":1671820560,"dia":"Viernes","fecha":"12/23/2022 01:20 pm","fijo":"052","suma":"535","corrido":"483","corrido1":"74","corrido2":"83","fireball":"8","draw":"Dia","createAt":"2022-12-23T18:36:01.042Z","updateAt":"2022-12-23T18:36:01.043Z","id":13135},{"tstamp":1671763740,"dia":"Jueves","fecha":"12/22/2022 09:35 pm","fijo":"574","suma":"111","corrido":"537","corrido1":"95","corrido2":"37","fireball":"2","draw":"Noche","createAt":"2022-12-23T02:49:00.573Z","updateAt":"2022-12-23T02:49:00.575Z","id":13134},{"tstamp":1671734160,"dia":"Jueves","fecha":"12/22/2022 01:20 pm","fijo":"724","suma":"672","corrido":"948","corrido1":"99","corrido2":"48","fireball":"5","draw":"Dia","createAt":"2022-12-22T18:36:00.891Z","updateAt":"2022-12-22T18:36:00.892Z","id":13133},{"tstamp":1671677340,"dia":"Miércoles","fecha":"12/21/2022 09:35 pm","fijo":"620","suma":"188","corrido":"568","corrido1":"45","corrido2":"68","fireball":"3","draw":"Noche","createAt":"2022-12-22T02:49:00.851Z","updateAt":"2022-12-22T02:49:00.852Z","id":13132},{"tstamp":1671647880,"dia":"Miércoles","fecha":"12/21/2022 01:20 pm","fijo":"901","suma":"264","corrido":"363","corrido1":"73","corrido2":"63","fireball":"1","draw":"Dia","createAt":"2022-12-21T18:38:01.063Z","updateAt":"2022-12-21T18:38:01.066Z","id":13131},{"tstamp":1671590940,"dia":"Martes","fecha":"12/20/2022 09:35 pm","fijo":"874","suma":"871","corrido":"997","corrido1":"59","corrido2":"97","fireball":"4","draw":"Noche","createAt":"2022-12-21T02:49:00.658Z","updateAt":"2022-12-21T02:49:00.661Z","id":13130},{"tstamp":1671561360,"dia":"Martes","fecha":"12/20/2022 01:20 pm","fijo":"066","suma":"622","corrido":"556","corrido1":"25","corrido2":"56","fireball":"3","draw":"Dia","createAt":"2022-12-20T18:36:00.609Z","updateAt":"2022-12-20T18:36:00.620Z","id":13129},{"tstamp":1671504660,"dia":"Lunes","fecha":"12/19/2022 09:35 pm","fijo":"380","suma":"798","corrido":"418","corrido1":"34","corrido2":"18","fireball":"0","draw":"Noche","createAt":"2022-12-20T02:51:00.692Z","updateAt":"2022-12-20T02:51:00.695Z","id":13128},{"tstamp":1671474961,"dia":"Lunes","fecha":"12/19/2022 01:20 pm","fijo":"974","suma":"440","corrido":"466","corrido1":"94","corrido2":"66","fireball":"2","draw":"Dia","createAt":"2022-12-19T18:36:01.446Z","updateAt":"2022-12-19T18:36:01.451Z","id":13127},{"tstamp":1671418140,"dia":"Domingo","fecha":"12/18/2022 09:35 pm","fijo":"889","suma":"643","corrido":"754","corrido1":"37","corrido2":"54","fireball":"7","draw":"Noche","createAt":"2022-12-19T02:49:00.914Z","updateAt":"2022-12-19T02:49:00.917Z","id":13126},{"tstamp":1671388440,"dia":"Domingo","fecha":"12/18/2022 01:20 pm","fijo":"209","suma":"186","corrido":"977","corrido1":"79","corrido2":"77","fireball":"0","draw":"Dia","createAt":"2022-12-18T18:34:01.244Z","updateAt":"2022-12-18T18:34:01.245Z","id":13125},{"tstamp":1671331740,"dia":"Sábado","fecha":"12/17/2022 09:35 pm","fijo":"627","suma":"242","corrido":"615","corrido1":"46","corrido2":"15","fireball":"0","draw":"Noche","createAt":"2022-12-18T02:49:00.740Z","updateAt":"2022-12-18T02:49:00.744Z","id":13124},{"tstamp":1671302040,"dia":"Sábado","fecha":"12/17/2022 01:20 pm","fijo":"749","suma":"656","corrido":"907","corrido1":"39","corrido2":"07","fireball":"8","draw":"Dia","createAt":"2022-12-17T18:34:00.741Z","updateAt":"2022-12-17T18:34:00.745Z","id":13123},{"tstamp":1671245460,"dia":"Viernes","fecha":"12/16/2022 09:35 pm","fijo":"584","suma":"568","corrido":"984","corrido1":"49","corrido2":"84","fireball":"8","draw":"Noche","createAt":"2022-12-17T02:51:00.455Z","updateAt":"2022-12-17T02:51:00.458Z","id":13122},{"tstamp":1671215640,"dia":"Viernes","fecha":"12/16/2022 01:20 pm","fijo":"429","suma":"635","corrido":"206","corrido1":"92","corrido2":"06","fireball":"5","draw":"Dia","createAt":"2022-12-16T18:34:01.045Z","updateAt":"2022-12-16T18:34:01.048Z","id":13121},{"tstamp":1671159060,"dia":"Jueves","fecha":"12/15/2022 09:35 pm","fijo":"559","suma":"143","corrido":"584","corrido1":"45","corrido2":"84","fireball":"6","draw":"Noche","createAt":"2022-12-16T02:51:00.877Z","updateAt":"2022-12-16T02:51:00.878Z","id":13120},{"tstamp":1671129240,"dia":"Jueves","fecha":"12/15/2022 01:20 pm","fijo":"282","suma":"085","corrido":"803","corrido1":"68","corrido2":"03","fireball":"3","draw":"Dia","createAt":"2022-12-15T18:34:01.299Z","updateAt":"2022-12-15T18:34:01.300Z","id":13119},{"tstamp":1671072541,"dia":"Miércoles","fecha":"12/14/2022 09:35 pm","fijo":"407","suma":"884","corrido":"477","corrido1":"64","corrido2":"77","fireball":"6","draw":"Noche","createAt":"2022-12-15T02:49:01.251Z","updateAt":"2022-12-15T02:49:01.253Z","id":13118},{"tstamp":1671042840,"dia":"Miércoles","fecha":"12/14/2022 01:20 pm","fijo":"292","suma":"500","corrido":"208","corrido1":"72","corrido2":"08","fireball":"8","draw":"Dia","createAt":"2022-12-14T18:34:00.828Z","updateAt":"2022-12-14T18:34:00.836Z","id":13117},{"tstamp":1670986260,"dia":"Martes","fecha":"12/13/2022 09:35 pm","fijo":"563","suma":"389","corrido":"826","corrido1":"08","corrido2":"26","fireball":"5","draw":"Noche","createAt":"2022-12-14T02:51:01.289Z","updateAt":"2022-12-14T02:51:01.292Z","id":13116},{"tstamp":1670956560,"dia":"Martes","fecha":"12/13/2022 01:20 pm","fijo":"570","suma":"560","corrido":"990","corrido1":"39","corrido2":"90","fireball":"2","draw":"Dia","createAt":"2022-12-13T18:36:00.841Z","updateAt":"2022-12-13T18:36:00.845Z","id":13115},{"tstamp":1670899860,"dia":"Lunes","fecha":"12/12/2022 09:35 pm","fijo":"985","suma":"530","corrido":"545","corrido1":"35","corrido2":"45","fireball":"1","draw":"Noche","createAt":"2022-12-13T02:51:01.055Z","updateAt":"2022-12-13T02:51:01.059Z","id":13114},{"tstamp":1670870161,"dia":"Lunes","fecha":"12/12/2022 01:20 pm","fijo":"853","suma":"251","corrido":"398","corrido1":"93","corrido2":"98","fireball":"5","draw":"Dia","createAt":"2022-12-12T18:36:01.233Z","updateAt":"2022-12-12T18:36:01.236Z","id":13113},{"tstamp":1670813460,"dia":"Domingo","fecha":"12/11/2022 09:35 pm","fijo":"668","suma":"105","corrido":"437","corrido1":"44","corrido2":"37","fireball":"9","draw":"Noche","createAt":"2022-12-12T02:51:00.775Z","updateAt":"2022-12-12T02:51:00.778Z","id":13112},{"tstamp":1670783640,"dia":"Domingo","fecha":"12/11/2022 01:20 pm","fijo":"610","suma":"170","corrido":"560","corrido1":"25","corrido2":"60","fireball":"7","draw":"Dia","createAt":"2022-12-11T18:34:00.917Z","updateAt":"2022-12-11T18:34:00.920Z","id":13111},{"tstamp":1670727060,"dia":"Sábado","fecha":"12/10/2022 09:35 pm","fijo":"873","suma":"518","corrido":"645","corrido1":"86","corrido2":"45","fireball":"9","draw":"Noche","createAt":"2022-12-11T02:51:00.633Z","updateAt":"2022-12-11T02:51:00.636Z","id":13110},{"tstamp":1670697240,"dia":"Sábado","fecha":"12/10/2022 01:20 pm","fijo":"654","suma":"315","corrido":"661","corrido1":"36","corrido2":"61","fireball":"4","draw":"Dia","createAt":"2022-12-10T18:34:01.135Z","updateAt":"2022-12-10T18:34:01.139Z","id":13109},{"tstamp":1670640660,"dia":"Viernes","fecha":"12/09/2022 09:35 pm","fijo":"892","suma":"269","corrido":"377","corrido1":"03","corrido2":"77","fireball":"7","draw":"Noche","createAt":"2022-12-10T02:51:00.888Z","updateAt":"2022-12-10T02:51:00.890Z","id":13108},{"tstamp":1670610841,"dia":"Viernes","fecha":"12/09/2022 01:20 pm","fijo":"846","suma":"099","corrido":"253","corrido1":"12","corrido2":"53","fireball":"5","draw":"Dia","createAt":"2022-12-09T18:34:01.364Z","updateAt":"2022-12-09T18:34:01.367Z","id":13107},{"tstamp":1670554260,"dia":"Jueves","fecha":"12/08/2022 09:35 pm","fijo":"696","suma":"610","corrido":"914","corrido1":"29","corrido2":"14","fireball":"2","draw":"Noche","createAt":"2022-12-09T02:51:01.115Z","updateAt":"2022-12-09T02:51:01.119Z","id":13106},{"tstamp":1670524560,"dia":"Jueves","fecha":"12/08/2022 01:20 pm","fijo":"483","suma":"261","corrido":"778","corrido1":"67","corrido2":"78","fireball":"1","draw":"Dia","createAt":"2022-12-08T18:36:00.826Z","updateAt":"2022-12-08T18:36:00.827Z","id":13105},{"tstamp":1670467860,"dia":"Miércoles","fecha":"12/07/2022 09:35 pm","fijo":"545","suma":"833","corrido":"288","corrido1":"22","corrido2":"88","fireball":"5","draw":"Noche","createAt":"2022-12-08T02:51:01.159Z","updateAt":"2022-12-08T02:51:01.162Z","id":13104},{"tstamp":1670438160,"dia":"Miércoles","fecha":"12/07/2022 01:20 pm","fijo":"194","suma":"258","corrido":"064","corrido1":"80","corrido2":"64","fireball":"4","draw":"Dia","createAt":"2022-12-07T18:36:01.123Z","updateAt":"2022-12-07T18:36:01.126Z","id":13103},{"tstamp":1670381460,"dia":"Martes","fecha":"12/06/2022 09:35 pm","fijo":"378","suma":"534","corrido":"156","corrido1":"71","corrido2":"56","fireball":"6","draw":"Noche","createAt":"2022-12-07T02:51:00.529Z","updateAt":"2022-12-07T02:51:00.530Z","id":13102},{"tstamp":1670351760,"dia":"Martes","fecha":"12/06/2022 01:20 pm","fijo":"340","suma":"124","corrido":"784","corrido1":"27","corrido2":"84","fireball":"0","draw":"Dia","createAt":"2022-12-06T18:36:00.620Z","updateAt":"2022-12-06T18:36:00.620Z","id":13101},{"tstamp":1670295061,"dia":"Lunes","fecha":"12/05/2022 09:35 pm","fijo":"322","suma":"885","corrido":"563","corrido1":"45","corrido2":"63","fireball":"3","draw":"Noche","createAt":"2022-12-06T02:51:01.282Z","updateAt":"2022-12-06T02:51:01.285Z","id":13100},{"tstamp":1670265481,"dia":"Lunes","fecha":"12/05/2022 01:20 pm","fijo":"730","suma":"828","corrido":"098","corrido1":"20","corrido2":"98","fireball":"9","draw":"Dia","createAt":"2022-12-05T18:38:01.258Z","updateAt":"2022-12-05T18:38:01.259Z","id":13099},{"tstamp":1670208660,"dia":"Domingo","fecha":"12/04/2022 09:35 pm","fijo":"718","suma":"212","corrido":"494","corrido1":"94","corrido2":"94","fireball":"0","draw":"Noche","createAt":"2022-12-05T02:51:00.515Z","updateAt":"2022-12-05T02:51:00.516Z","id":13098},{"tstamp":1670178961,"dia":"Domingo","fecha":"12/04/2022 01:20 pm","fijo":"942","suma":"722","corrido":"780","corrido1":"47","corrido2":"80","fireball":"8","draw":"Dia","createAt":"2022-12-04T18:36:01.306Z","updateAt":"2022-12-04T18:36:01.309Z","id":13097},{"tstamp":1670122140,"dia":"Sábado","fecha":"12/03/2022 09:35 pm","fijo":"728","suma":"959","corrido":"231","corrido1":"62","corrido2":"31","fireball":"0","draw":"Noche","createAt":"2022-12-04T02:49:00.549Z","updateAt":"2022-12-04T02:49:00.552Z","id":13096},{"tstamp":1670092560,"dia":"Sábado","fecha":"12/03/2022 01:20 pm","fijo":"291","suma":"509","corrido":"218","corrido1":"92","corrido2":"18","fireball":"2","draw":"Dia","createAt":"2022-12-03T18:36:01.008Z","updateAt":"2022-12-03T18:36:01.010Z","id":13095},{"tstamp":1670035980,"dia":"Viernes","fecha":"12/02/2022 09:35 pm","fijo":"876","suma":"014","corrido":"138","corrido1":"71","corrido2":"38","fireball":"9","draw":"Noche","createAt":"2022-12-03T02:53:00.608Z","updateAt":"2022-12-03T02:53:00.611Z","id":13094},{"tstamp":1670006160,"dia":"Viernes","fecha":"12/02/2022 01:20 pm","fijo":"211","suma":"531","corrido":"320","corrido1":"03","corrido2":"20","fireball":"0","draw":"Dia","createAt":"2022-12-02T18:36:00.829Z","updateAt":"2022-12-02T18:36:00.832Z","id":13093},{"tstamp":1669949460,"dia":"Jueves","fecha":"12/01/2022 09:35 pm","fijo":"512","suma":"358","corrido":"846","corrido1":"68","corrido2":"46","fireball":"5","draw":"Noche","createAt":"2022-12-02T02:51:00.894Z","updateAt":"2022-12-02T02:51:00.895Z","id":13092},{"tstamp":1669919640,"dia":"Jueves","fecha":"12/01/2022 01:20 pm","fijo":"052","suma":"683","corrido":"631","corrido1":"56","corrido2":"31","fireball":"1","draw":"Dia","createAt":"2022-12-01T18:34:01.555Z","updateAt":"2022-12-01T18:34:01.559Z","id":13091},{"tstamp":1669862940,"dia":"Miércoles","fecha":"11/30/2022 09:35 pm","fijo":"800","suma":"165","corrido":"365","corrido1":"13","corrido2":"65","fireball":"4","draw":"Noche","createAt":"2022-12-01T02:49:00.931Z","updateAt":"2022-12-01T02:49:00.932Z","id":13090},{"tstamp":1669833360,"dia":"Miércoles","fecha":"11/30/2022 01:20 pm","fijo":"570","suma":"887","corrido":"317","corrido1":"33","corrido2":"17","fireball":"6","draw":"Dia","createAt":"2022-11-30T18:36:00.580Z","updateAt":"2022-11-30T18:36:00.581Z","id":13089},{"tstamp":1669776660,"dia":"Martes","fecha":"11/29/2022 09:35 pm","fijo":"573","suma":"541","corrido":"968","corrido1":"29","corrido2":"68","fireball":"2","draw":"Noche","createAt":"2022-11-30T02:51:00.782Z","updateAt":"2022-11-30T02:51:00.783Z","id":13088},{"tstamp":1669746960,"dia":"Martes","fecha":"11/29/2022 01:20 pm","fijo":"250","suma":"958","corrido":"708","corrido1":"07","corrido2":"08","fireball":"4","draw":"Dia","createAt":"2022-11-29T18:36:00.636Z","updateAt":"2022-11-29T18:36:00.651Z","id":13087},{"tstamp":1669690140,"dia":"Lunes","fecha":"11/28/2022 09:35 pm","fijo":"749","suma":"650","corrido":"901","corrido1":"49","corrido2":"01","fireball":"5","draw":"Noche","createAt":"2022-11-29T02:49:00.440Z","updateAt":"2022-11-29T02:49:00.448Z","id":13086},{"tstamp":1669660441,"dia":"Lunes","fecha":"11/28/2022 01:20 pm","fijo":"151","suma":"727","corrido":"576","corrido1":"55","corrido2":"76","fireball":"6","draw":"Dia","createAt":"2022-11-28T18:34:01.285Z","updateAt":"2022-11-28T18:34:01.286Z","id":13085},{"tstamp":1669603861,"dia":"Domingo","fecha":"11/27/2022 09:35 pm","fijo":"919","suma":"005","corrido":"086","corrido1":"80","corrido2":"86","fireball":"9","draw":"Noche","createAt":"2022-11-28T02:51:01.275Z","updateAt":"2022-11-28T02:51:01.276Z","id":13084},{"tstamp":1669574041,"dia":"Domingo","fecha":"11/27/2022 01:20 pm","fijo":"266","suma":"759","corrido":"493","corrido1":"94","corrido2":"93","fireball":"7","draw":"Dia","createAt":"2022-11-27T18:34:01.242Z","updateAt":"2022-11-27T18:34:01.246Z","id":13083},{"tstamp":1669517340,"dia":"Sábado","fecha":"11/26/2022 09:35 pm","fijo":"981","suma":"278","corrido":"297","corrido1":"92","corrido2":"97","fireball":"6","draw":"Noche","createAt":"2022-11-27T02:49:01.066Z","updateAt":"2022-11-27T02:49:01.067Z","id":13082},{"tstamp":1669487760,"dia":"Sábado","fecha":"11/26/2022 01:20 pm","fijo":"653","suma":"985","corrido":"332","corrido1":"43","corrido2":"32","fireball":"5","draw":"Dia","createAt":"2022-11-26T18:36:00.590Z","updateAt":"2022-11-26T18:36:00.593Z","id":13081},{"tstamp":1669431060,"dia":"Viernes","fecha":"11/25/2022 09:35 pm","fijo":"513","suma":"638","corrido":"125","corrido1":"01","corrido2":"25","fireball":"5","draw":"Noche","createAt":"2022-11-26T02:51:01.265Z","updateAt":"2022-11-26T02:51:01.266Z","id":13080},{"tstamp":1669401361,"dia":"Viernes","fecha":"11/25/2022 01:20 pm","fijo":"682","suma":"210","corrido":"528","corrido1":"65","corrido2":"28","fireball":"1","draw":"Dia","createAt":"2022-11-25T18:36:01.274Z","updateAt":"2022-11-25T18:36:01.278Z","id":13079},{"tstamp":1669344660,"dia":"Jueves","fecha":"11/24/2022 09:35 pm","fijo":"868","suma":"350","corrido":"482","corrido1":"14","corrido2":"82","fireball":"3","draw":"Noche","createAt":"2022-11-25T02:51:01.009Z","updateAt":"2022-11-25T02:51:01.012Z","id":13078},{"tstamp":1669314840,"dia":"Jueves","fecha":"11/24/2022 01:20 pm","fijo":"972","suma":"100","corrido":"128","corrido1":"31","corrido2":"28","fireball":"8","draw":"Dia","createAt":"2022-11-24T18:34:00.653Z","updateAt":"2022-11-24T18:34:00.655Z","id":13077},{"tstamp":1669258140,"dia":"Miércoles","fecha":"11/23/2022 09:35 pm","fijo":"083","suma":"646","corrido":"563","corrido1":"85","corrido2":"63","fireball":"8","draw":"Noche","createAt":"2022-11-24T02:49:00.814Z","updateAt":"2022-11-24T02:49:00.817Z","id":13076},{"tstamp":1669228560,"dia":"Miércoles","fecha":"11/23/2022 01:20 pm","fijo":"688","suma":"320","corrido":"632","corrido1":"16","corrido2":"32","fireball":"1","draw":"Dia","createAt":"2022-11-23T18:36:01.095Z","updateAt":"2022-11-23T18:36:01.098Z","id":13075},{"tstamp":1669171740,"dia":"Martes","fecha":"11/22/2022 09:35 pm","fijo":"038","suma":"005","corrido":"967","corrido1":"59","corrido2":"67","fireball":"1","draw":"Noche","createAt":"2022-11-23T02:49:00.454Z","updateAt":"2022-11-23T02:49:00.457Z","id":13074},{"tstamp":1669142040,"dia":"Martes","fecha":"11/22/2022 01:20 pm","fijo":"872","suma":"006","corrido":"134","corrido1":"11","corrido2":"34","fireball":"1","draw":"Dia","createAt":"2022-11-22T18:34:00.737Z","updateAt":"2022-11-22T18:34:00.738Z","id":13073},{"tstamp":1669085460,"dia":"Lunes","fecha":"11/21/2022 09:35 pm","fijo":"452","suma":"221","corrido":"769","corrido1":"87","corrido2":"69","fireball":"8","draw":"Noche","createAt":"2022-11-22T02:51:00.780Z","updateAt":"2022-11-22T02:51:00.783Z","id":13072},{"tstamp":1669055760,"dia":"Lunes","fecha":"11/21/2022 01:20 pm","fijo":"117","suma":"719","corrido":"602","corrido1":"86","corrido2":"02","fireball":"7","draw":"Dia","createAt":"2022-11-21T18:36:00.834Z","updateAt":"2022-11-21T18:36:00.838Z","id":13071},{"tstamp":1668998940,"dia":"Domingo","fecha":"11/20/2022 09:35 pm","fijo":"538","suma":"127","corrido":"589","corrido1":"55","corrido2":"89","fireball":"7","draw":"Noche","createAt":"2022-11-21T02:49:00.419Z","updateAt":"2022-11-21T02:49:00.420Z","id":13070},{"tstamp":1668969240,"dia":"Domingo","fecha":"11/20/2022 01:20 pm","fijo":"188","suma":"672","corrido":"484","corrido1":"14","corrido2":"84","fireball":"9","draw":"Dia","createAt":"2022-11-20T18:34:00.502Z","updateAt":"2022-11-20T18:34:00.503Z","id":13069},{"tstamp":1668912540,"dia":"Sábado","fecha":"11/19/2022 09:35 pm","fijo":"940","suma":"322","corrido":"382","corrido1":"73","corrido2":"82","fireball":"3","draw":"Noche","createAt":"2022-11-20T02:49:00.483Z","updateAt":"2022-11-20T02:49:00.486Z","id":13068},{"tstamp":1668882960,"dia":"Sábado","fecha":"11/19/2022 01:20 pm","fijo":"793","suma":"573","corrido":"780","corrido1":"27","corrido2":"80","fireball":"0","draw":"Dia","createAt":"2022-11-19T18:36:00.873Z","updateAt":"2022-11-19T18:36:00.876Z","id":13067},{"tstamp":1668826260,"dia":"Viernes","fecha":"11/18/2022 09:35 pm","fijo":"015","suma":"640","corrido":"625","corrido1":"96","corrido2":"25","fireball":"4","draw":"Noche","createAt":"2022-11-19T02:51:01.118Z","updateAt":"2022-11-19T02:51:01.121Z","id":13066},{"tstamp":1668796560,"dia":"Viernes","fecha":"11/18/2022 01:20 pm","fijo":"325","suma":"358","corrido":"033","corrido1":"20","corrido2":"33","fireball":"1","draw":"Dia","createAt":"2022-11-18T18:36:00.636Z","updateAt":"2022-11-18T18:36:00.639Z","id":13065},{"tstamp":1668739861,"dia":"Jueves","fecha":"11/17/2022 09:35 pm","fijo":"522","suma":"273","corrido":"751","corrido1":"87","corrido2":"51","fireball":"8","draw":"Noche","createAt":"2022-11-18T02:51:01.204Z","updateAt":"2022-11-18T02:51:01.207Z","id":13064},{"tstamp":1668710161,"dia":"Jueves","fecha":"11/17/2022 01:20 pm","fijo":"761","suma":"928","corrido":"167","corrido1":"21","corrido2":"67","fireball":"2","draw":"Dia","createAt":"2022-11-17T18:36:01.282Z","updateAt":"2022-11-17T18:36:01.283Z","id":13063},{"tstamp":1668653460,"dia":"Miércoles","fecha":"11/16/2022 09:35 pm","fijo":"792","suma":"362","corrido":"570","corrido1":"95","corrido2":"70","fireball":"0","draw":"Noche","createAt":"2022-11-17T02:51:00.765Z","updateAt":"2022-11-17T02:51:00.766Z","id":13062},{"tstamp":1668623761,"dia":"Miércoles","fecha":"11/16/2022 01:20 pm","fijo":"158","suma":"618","corrido":"460","corrido1":"14","corrido2":"60","fireball":"8","draw":"Dia","createAt":"2022-11-16T18:36:01.324Z","updateAt":"2022-11-16T18:36:01.326Z","id":13061},{"tstamp":1668566940,"dia":"Martes","fecha":"11/15/2022 09:35 pm","fijo":"534","suma":"084","corrido":"550","corrido1":"65","corrido2":"50","fireball":"7","draw":"Noche","createAt":"2022-11-16T02:49:00.969Z","updateAt":"2022-11-16T02:49:00.971Z","id":13060},{"tstamp":1668537241,"dia":"Martes","fecha":"11/15/2022 01:20 pm","fijo":"825","suma":"079","corrido":"254","corrido1":"72","corrido2":"54","fireball":"0","draw":"Dia","createAt":"2022-11-15T18:34:01.233Z","updateAt":"2022-11-15T18:34:01.234Z","id":13059},{"tstamp":1668480660,"dia":"Lunes","fecha":"11/14/2022 09:35 pm","fijo":"643","suma":"336","corrido":"693","corrido1":"56","corrido2":"93","fireball":"7","draw":"Noche","createAt":"2022-11-15T02:51:00.872Z","updateAt":"2022-11-15T02:51:00.875Z","id":13058},{"tstamp":1668450840,"dia":"Lunes","fecha":"11/14/2022 01:20 pm","fijo":"667","suma":"235","corrido":"568","corrido1":"75","corrido2":"68","fireball":"5","draw":"Dia","createAt":"2022-11-14T18:34:00.459Z","updateAt":"2022-11-14T18:34:00.462Z","id":13057},{"tstamp":1668394260,"dia":"Domingo","fecha":"11/13/2022 09:35 pm","fijo":"209","suma":"066","corrido":"857","corrido1":"68","corrido2":"57","fireball":"3","draw":"Noche","createAt":"2022-11-14T02:51:00.628Z","updateAt":"2022-11-14T02:51:00.631Z","id":13056},{"tstamp":1668364440,"dia":"Domingo","fecha":"11/13/2022 01:20 pm","fijo":"178","suma":"115","corrido":"937","corrido1":"49","corrido2":"37","fireball":"4","draw":"Dia","createAt":"2022-11-13T18:34:00.664Z","updateAt":"2022-11-13T18:34:00.665Z","id":13055},{"tstamp":1668307740,"dia":"Sábado","fecha":"11/12/2022 09:35 pm","fijo":"497","suma":"780","corrido":"283","corrido1":"62","corrido2":"83","fireball":"9","draw":"Noche","createAt":"2022-11-13T02:49:00.513Z","updateAt":"2022-11-13T02:49:00.515Z","id":13054},{"tstamp":1668278161,"dia":"Sábado","fecha":"11/12/2022 01:20 pm","fijo":"480","suma":"581","corrido":"101","corrido1":"11","corrido2":"01","fireball":"8","draw":"Dia","createAt":"2022-11-12T18:36:01.299Z","updateAt":"2022-11-12T18:36:01.301Z","id":13053},{"tstamp":1668221461,"dia":"Viernes","fecha":"11/11/2022 09:35 pm","fijo":"206","suma":"632","corrido":"426","corrido1":"44","corrido2":"26","fireball":"2","draw":"Noche","createAt":"2022-11-12T02:51:01.260Z","updateAt":"2022-11-12T02:51:01.263Z","id":13052},{"tstamp":1668191760,"dia":"Viernes","fecha":"11/11/2022 01:20 pm","fijo":"944","suma":"824","corrido":"880","corrido1":"48","corrido2":"80","fireball":"1","draw":"Dia","createAt":"2022-11-11T18:36:01.144Z","updateAt":"2022-11-11T18:36:01.145Z","id":13051},{"tstamp":1668135060,"dia":"Jueves","fecha":"11/10/2022 09:35 pm","fijo":"082","suma":"971","corrido":"889","corrido1":"98","corrido2":"89","fireball":"8","draw":"Noche","createAt":"2022-11-11T02:51:01.111Z","updateAt":"2022-11-11T02:51:01.114Z","id":13050},{"tstamp":1668105361,"dia":"Jueves","fecha":"11/10/2022 01:20 pm","fijo":"561","suma":"719","corrido":"158","corrido1":"51","corrido2":"58","fireball":"2","draw":"Dia","createAt":"2022-11-10T18:36:01.272Z","updateAt":"2022-11-10T18:36:01.275Z","id":13049},{"tstamp":1668048660,"dia":"Miércoles","fecha":"11/09/2022 09:35 pm","fijo":"153","suma":"981","corrido":"828","corrido1":"78","corrido2":"28","fireball":"9","draw":"Noche","createAt":"2022-11-10T02:51:00.453Z","updateAt":"2022-11-10T02:51:00.456Z","id":13048},{"tstamp":1668018961,"dia":"Miércoles","fecha":"11/09/2022 01:20 pm","fijo":"555","suma":"154","corrido":"599","corrido1":"45","corrido2":"99","fireball":"8","draw":"Dia","createAt":"2022-11-09T18:36:01.268Z","updateAt":"2022-11-09T18:36:01.269Z","id":13047},{"tstamp":1667962141,"dia":"Martes","fecha":"11/08/2022 09:35 pm","fijo":"452","suma":"400","corrido":"948","corrido1":"49","corrido2":"48","fireball":"9","draw":"Noche","createAt":"2022-11-09T02:49:01.238Z","updateAt":"2022-11-09T02:49:01.241Z","id":13046},{"tstamp":1667933040,"dia":"Martes","fecha":"11/08/2022 01:20 pm","fijo":"349","suma":"937","corrido":"588","corrido1":"35","corrido2":"88","fireball":"0","draw":"Dia","createAt":"2022-11-08T18:44:13.159Z","updateAt":"2022-11-08T18:44:13.162Z","id":13045},{"tstamp":1667875860,"dia":"Lunes","fecha":"11/07/2022 09:35 pm","fijo":"109","suma":"922","corrido":"813","corrido1":"18","corrido2":"13","fireball":"1","draw":"Noche","createAt":"2022-11-08T02:51:02.440Z","updateAt":"2022-11-08T02:51:02.441Z","id":13044},{"tstamp":1667846160,"dia":"Lunes","fecha":"11/07/2022 01:20 pm","fijo":"811","suma":"131","corrido":"320","corrido1":"43","corrido2":"20","fireball":"8","draw":"Dia","createAt":"2022-11-07T18:36:01.167Z","updateAt":"2022-11-07T18:36:01.172Z","id":13043},{"tstamp":1667789341,"dia":"Domingo","fecha":"11/06/2022 09:35 pm","fijo":"983","suma":"447","corrido":"464","corrido1":"94","corrido2":"64","fireball":"1","draw":"Noche","createAt":"2022-11-07T02:49:01.300Z","updateAt":"2022-11-07T02:49:01.303Z","id":13042},{"tstamp":1667759640,"dia":"Domingo","fecha":"11/06/2022 01:20 pm","fijo":"207","suma":"523","corrido":"316","corrido1":"73","corrido2":"16","fireball":"4","draw":"Dia","createAt":"2022-11-06T18:34:16.748Z","updateAt":"2022-11-06T18:34:16.751Z","id":13040},{"tstamp":1667699460,"dia":"Sábado","fecha":"11/05/2022 09:35 pm","fijo":"015","suma":"871","corrido":"856","corrido1":"68","corrido2":"56","fireball":"2","draw":"Noche","createAt":"2022-11-06T01:51:00.571Z","updateAt":"2022-11-06T01:51:00.574Z","id":13039},{"tstamp":1667669640,"dia":"Sábado","fecha":"11/05/2022 01:20 pm","fijo":"471","suma":"664","corrido":"193","corrido1":"41","corrido2":"93","fireball":"6","draw":"Dia","createAt":"2022-11-05T17:34:00.931Z","updateAt":"2022-11-05T17:34:00.933Z","id":13038},{"tstamp":1667613060,"dia":"Viernes","fecha":"11/04/2022 09:35 pm","fijo":"243","suma":"258","corrido":"015","corrido1":"30","corrido2":"15","fireball":"6","draw":"Noche","createAt":"2022-11-05T01:51:00.911Z","updateAt":"2022-11-05T01:51:00.912Z","id":13037},{"tstamp":1667583360,"dia":"Viernes","fecha":"11/04/2022 01:20 pm","fijo":"889","suma":"736","corrido":"847","corrido1":"48","corrido2":"47","fireball":"7","draw":"Dia","createAt":"2022-11-04T17:36:00.841Z","updateAt":"2022-11-04T17:36:00.844Z","id":13036},{"tstamp":1667526780,"dia":"Jueves","fecha":"11/03/2022 09:35 pm","fijo":"286","suma":"455","corrido":"169","corrido1":"91","corrido2":"69","fireball":"7","draw":"Noche","createAt":"2022-11-04T01:53:00.824Z","updateAt":"2022-11-04T01:53:00.825Z","id":13035},{"id":13034,"tstamp":1667496005,"dia":"Jueves","fecha":"11/03/2022 01:20 pm","fijo":"761","corrido":"293","suma":"054","corrido1":"62","corrido2":"93","draw":"Dia","fireball":"6"},{"id":13033,"tstamp":1667439305,"dia":"Miercoles","fecha":"11/02/2022 09:35 pm","fijo":"997","corrido":"201","suma":"198","corrido1":"92","corrido2":"01","draw":"Noche","fireball":"7"},{"id":13032,"tstamp":1667409605,"dia":"Miercoles","fecha":"11/02/2022 01:20 pm","fijo":"625","corrido":"108","suma":"733","corrido1":"11","corrido2":"08","draw":"Dia","fireball":"3"},{"id":13031,"tstamp":1667352905,"dia":"Martes","fecha":"11/01/2022 09:35 pm","fijo":"322","corrido":"232","suma":"554","corrido1":"42","corrido2":"32","draw":"Noche","fireball":"0"},{"id":13030,"tstamp":1667323205,"dia":"Martes","fecha":"11/01/2022 01:20 pm","fijo":"721","corrido":"315","suma":"036","corrido1":"63","corrido2":"15","draw":"Dia","fireball":"4"},{"id":13029,"tstamp":1667266505,"dia":"Lunes","fecha":"10/31/2022 09:35 pm","fijo":"536","corrido":"158","suma":"694","corrido1":"71","corrido2":"58","draw":"Noche","fireball":"3"},{"id":13028,"tstamp":1667236805,"dia":"Lunes","fecha":"10/31/2022 01:20 pm","fijo":"040","corrido":"291","suma":"331","corrido1":"62","corrido2":"91","draw":"Dia","fireball":"9"},{"id":13027,"tstamp":1667180105,"dia":"Domingo","fecha":"10/30/2022 09:35 pm","fijo":"217","corrido":"588","suma":"805","corrido1":"05","corrido2":"88","draw":"Noche","fireball":"6"},{"id":13026,"tstamp":1667150405,"dia":"Domingo","fecha":"10/30/2022 01:20 pm","fijo":"236","corrido":"157","suma":"393","corrido1":"91","corrido2":"57","draw":"Dia","fireball":"5"},{"id":13025,"tstamp":1667093705,"dia":"Sabado","fecha":"10/29/2022 09:35 pm","fijo":"950","corrido":"354","suma":"304","corrido1":"33","corrido2":"54","draw":"Noche","fireball":"6"},{"id":13024,"tstamp":1667064005,"dia":"Sabado","fecha":"10/29/2022 01:20 pm","fijo":"682","corrido":"858","suma":"540","corrido1":"68","corrido2":"58","draw":"Dia","fireball":"5"},{"id":13023,"tstamp":1667007305,"dia":"Viernes","fecha":"10/28/2022 09:35 pm","fijo":"696","corrido":"895","suma":"591","corrido1":"28","corrido2":"95","draw":"Noche","fireball":"5"},{"id":13022,"tstamp":1666977605,"dia":"Viernes","fecha":"10/28/2022 01:20 pm","fijo":"043","corrido":"737","suma":"780","corrido1":"37","corrido2":"37","draw":"Dia","fireball":"5"},{"id":13021,"tstamp":1666920905,"dia":"Jueves","fecha":"10/27/2022 09:35 pm","fijo":"605","corrido":"822","suma":"427","corrido1":"78","corrido2":"22","draw":"Noche","fireball":"7"},{"id":13020,"tstamp":1666891205,"dia":"Jueves","fecha":"10/27/2022 01:20 pm","fijo":"428","corrido":"664","suma":"092","corrido1":"36","corrido2":"64","draw":"Dia","fireball":"9"},{"id":13019,"tstamp":1666834505,"dia":"Miercoles","fecha":"10/26/2022 09:35 pm","fijo":"549","corrido":"545","suma":"094","corrido1":"35","corrido2":"45","draw":"Noche","fireball":"9"},{"id":13018,"tstamp":1666804805,"dia":"Miercoles","fecha":"10/26/2022 01:20 pm","fijo":"088","corrido":"898","suma":"986","corrido1":"68","corrido2":"98","draw":"Dia","fireball":"5"},{"id":13017,"tstamp":1666748105,"dia":"Martes","fecha":"10/25/2022 09:35 pm","fijo":"452","corrido":"134","suma":"586","corrido1":"51","corrido2":"34","draw":"Noche","fireball":"5"},{"id":13016,"tstamp":1666718405,"dia":"Martes","fecha":"10/25/2022 01:20 pm","fijo":"822","corrido":"632","suma":"454","corrido1":"16","corrido2":"32","draw":"Dia","fireball":"3"},{"id":13015,"tstamp":1666661705,"dia":"Lunes","fecha":"10/24/2022 09:35 pm","fijo":"858","corrido":"721","suma":"579","corrido1":"87","corrido2":"21","draw":"Noche","fireball":"2"},{"id":13014,"tstamp":1666632005,"dia":"Lunes","fecha":"10/24/2022 01:20 pm","fijo":"380","corrido":"430","suma":"810","corrido1":"04","corrido2":"30","draw":"Dia","fireball":"2"},{"id":13013,"tstamp":1666575305,"dia":"Domingo","fecha":"10/23/2022 09:35 pm","fijo":"894","corrido":"087","suma":"981","corrido1":"50","corrido2":"87","draw":"Noche","fireball":"5"},{"id":13012,"tstamp":1666545605,"dia":"Domingo","fecha":"10/23/2022 01:20 pm","fijo":"357","corrido":"605","suma":"962","corrido1":"86","corrido2":"05","draw":"Dia","fireball":"3"},{"id":13011,"tstamp":1666488905,"dia":"Sabado","fecha":"10/22/2022 09:35 pm","fijo":"222","corrido":"494","suma":"716","corrido1":"64","corrido2":"94","draw":"Noche","fireball":"0"},{"id":13010,"tstamp":1666459205,"dia":"Sabado","fecha":"10/22/2022 01:20 pm","fijo":"908","corrido":"081","suma":"989","corrido1":"00","corrido2":"81","draw":"Dia","fireball":"2"},{"id":13009,"tstamp":1666402505,"dia":"Viernes","fecha":"10/21/2022 09:35 pm","fijo":"894","corrido":"148","suma":"042","corrido1":"61","corrido2":"48","draw":"Noche","fireball":"0"},{"id":13008,"tstamp":1666372805,"dia":"Viernes","fecha":"10/21/2022 01:20 pm","fijo":"389","corrido":"430","suma":"819","corrido1":"94","corrido2":"30","draw":"Dia","fireball":"8"},{"id":13007,"tstamp":1666316105,"dia":"Jueves","fecha":"10/20/2022 09:35 pm","fijo":"433","corrido":"780","suma":"213","corrido1":"77","corrido2":"80","draw":"Noche","fireball":"6"},{"id":13006,"tstamp":1666286405,"dia":"Jueves","fecha":"10/20/2022 01:20 pm","fijo":"320","corrido":"218","suma":"538","corrido1":"22","corrido2":"18","draw":"Dia","fireball":"4"},{"id":13005,"tstamp":1666229705,"dia":"Miercoles","fecha":"10/19/2022 09:35 pm","fijo":"405","corrido":"331","suma":"736","corrido1":"93","corrido2":"31","draw":"Noche","fireball":"5"},{"id":13004,"tstamp":1666200005,"dia":"Miercoles","fecha":"10/19/2022 01:20 pm","fijo":"859","corrido":"183","suma":"042","corrido1":"81","corrido2":"83","draw":"Dia","fireball":"2"},{"id":13003,"tstamp":1666143305,"dia":"Martes","fecha":"10/18/2022 09:35 pm","fijo":"077","corrido":"638","suma":"715","corrido1":"66","corrido2":"38","draw":"Noche","fireball":"0"},{"id":13002,"tstamp":1666113605,"dia":"Martes","fecha":"10/18/2022 01:20 pm","fijo":"490","corrido":"501","suma":"991","corrido1":"65","corrido2":"01","draw":"Dia","fireball":"4"},{"id":13001,"tstamp":1666056905,"dia":"Lunes","fecha":"10/17/2022 09:35 pm","fijo":"305","corrido":"339","suma":"644","corrido1":"93","corrido2":"39","draw":"Noche","fireball":"4"},{"id":13000,"tstamp":1666027205,"dia":"Lunes","fecha":"10/17/2022 01:20 pm","fijo":"853","corrido":"056","suma":"909","corrido1":"90","corrido2":"56","draw":"Dia","fireball":"0"},{"id":12999,"tstamp":1665970505,"dia":"Domingo","fecha":"10/16/2022 09:35 pm","fijo":"037","corrido":"330","suma":"367","corrido1":"43","corrido2":"30","draw":"Noche","fireball":"7"},{"id":12998,"tstamp":1665940805,"dia":"Domingo","fecha":"10/16/2022 01:20 pm","fijo":"008","corrido":"701","suma":"709","corrido1":"47","corrido2":"01","draw":"Dia","fireball":"6"},{"id":12997,"tstamp":1665884105,"dia":"Sabado","fecha":"10/15/2022 09:35 pm","fijo":"527","corrido":"545","suma":"072","corrido1":"15","corrido2":"45","draw":"Noche","fireball":"8"},{"id":12996,"tstamp":1665854405,"dia":"Sabado","fecha":"10/15/2022 01:20 pm","fijo":"880","corrido":"306","suma":"186","corrido1":"53","corrido2":"06","draw":"Dia","fireball":"6"},{"id":12995,"tstamp":1665797705,"dia":"Viernes","fecha":"10/14/2022 09:35 pm","fijo":"405","corrido":"085","suma":"490","corrido1":"80","corrido2":"85","draw":"Noche","fireball":"6"},{"id":12994,"tstamp":1665768005,"dia":"Viernes","fecha":"10/14/2022 01:20 pm","fijo":"126","corrido":"737","suma":"863","corrido1":"07","corrido2":"37","draw":"Dia","fireball":"3"},{"id":12993,"tstamp":1665711305,"dia":"Jueves","fecha":"10/13/2022 09:35 pm","fijo":"820","corrido":"394","suma":"214","corrido1":"63","corrido2":"94","draw":"Noche","fireball":"1"},{"id":12992,"tstamp":1665681605,"dia":"Jueves","fecha":"10/13/2022 01:20 pm","fijo":"176","corrido":"781","suma":"957","corrido1":"97","corrido2":"81","draw":"Dia","fireball":"9"},{"id":12991,"tstamp":1665624905,"dia":"Miercoles","fecha":"10/12/2022 09:35 pm","fijo":"994","corrido":"123","suma":"117","corrido1":"61","corrido2":"23","draw":"Noche","fireball":"3"},{"id":12990,"tstamp":1665595205,"dia":"Miercoles","fecha":"10/12/2022 01:20 pm","fijo":"316","corrido":"749","suma":"065","corrido1":"07","corrido2":"49","draw":"Dia","fireball":"9"},{"id":12989,"tstamp":1665538505,"dia":"Martes","fecha":"10/11/2022 09:35 pm","fijo":"311","corrido":"353","suma":"664","corrido1":"23","corrido2":"53","draw":"Noche","fireball":"0"},{"id":12988,"tstamp":1665508805,"dia":"Martes","fecha":"10/11/2022 01:20 pm","fijo":"398","corrido":"761","suma":"159","corrido1":"27","corrido2":"61","draw":"Dia","fireball":"0"},{"id":12987,"tstamp":1665452105,"dia":"Lunes","fecha":"10/10/2022 09:35 pm","fijo":"091","corrido":"980","suma":"071","corrido1":"99","corrido2":"80","draw":"Noche","fireball":"9"},{"id":12986,"tstamp":1665422405,"dia":"Lunes","fecha":"10/10/2022 01:20 pm","fijo":"045","corrido":"083","suma":"128","corrido1":"60","corrido2":"83","draw":"Dia","fireball":"6"},{"id":12985,"tstamp":1665365705,"dia":"Domingo","fecha":"10/09/2022 09:35 pm","fijo":"594","corrido":"677","suma":"271","corrido1":"16","corrido2":"77","draw":"Noche","fireball":"9"},{"id":12984,"tstamp":1665336005,"dia":"Domingo","fecha":"10/09/2022 01:20 pm","fijo":"414","corrido":"863","suma":"277","corrido1":"98","corrido2":"63","draw":"Dia","fireball":"3"},{"id":12983,"tstamp":1665279305,"dia":"Sabado","fecha":"10/08/2022 09:35 pm","fijo":"250","corrido":"485","suma":"735","corrido1":"64","corrido2":"85","draw":"Noche","fireball":"2"},{"id":12982,"tstamp":1665249605,"dia":"Sabado","fecha":"10/08/2022 01:20 pm","fijo":"861","corrido":"288","suma":"149","corrido1":"22","corrido2":"88","draw":"Dia","fireball":"2"},{"id":12981,"tstamp":1665192905,"dia":"Viernes","fecha":"10/07/2022 09:35 pm","fijo":"154","corrido":"526","suma":"680","corrido1":"55","corrido2":"26","draw":"Noche","fireball":"8"},{"id":12980,"tstamp":1665163205,"dia":"Viernes","fecha":"10/07/2022 01:20 pm","fijo":"253","corrido":"721","suma":"974","corrido1":"87","corrido2":"21","draw":"Dia","fireball":"5"},{"id":12979,"tstamp":1665106505,"dia":"Jueves","fecha":"10/06/2022 09:35 pm","fijo":"506","corrido":"784","suma":"290","corrido1":"07","corrido2":"84","draw":"Noche","fireball":"9"},{"id":12978,"tstamp":1665076805,"dia":"Jueves","fecha":"10/06/2022 01:20 pm","fijo":"992","corrido":"544","suma":"536","corrido1":"55","corrido2":"44","draw":"Dia","fireball":"5"},{"id":12977,"tstamp":1665020105,"dia":"Miercoles","fecha":"10/05/2022 09:35 pm","fijo":"953","corrido":"238","suma":"191","corrido1":"12","corrido2":"38","draw":"Noche","fireball":"7"},{"id":12976,"tstamp":1664990405,"dia":"Miercoles","fecha":"10/05/2022 01:20 pm","fijo":"023","corrido":"221","suma":"244","corrido1":"82","corrido2":"21","draw":"Dia","fireball":"3"},{"id":12975,"tstamp":1664933705,"dia":"Martes","fecha":"10/04/2022 09:35 pm","fijo":"299","corrido":"625","suma":"924","corrido1":"66","corrido2":"25","draw":"Noche","fireball":"1"},{"id":12974,"tstamp":1664904005,"dia":"Martes","fecha":"10/04/2022 01:20 pm","fijo":"325","corrido":"746","suma":"071","corrido1":"67","corrido2":"46","draw":"Dia","fireball":"9"},{"id":12973,"tstamp":1664847305,"dia":"Lunes","fecha":"10/03/2022 09:35 pm","fijo":"829","corrido":"030","suma":"859","corrido1":"10","corrido2":"30","draw":"Noche","fireball":"5"},{"id":12972,"tstamp":1664817605,"dia":"Lunes","fecha":"10/03/2022 01:20 pm","fijo":"392","corrido":"582","suma":"974","corrido1":"55","corrido2":"82","draw":"Dia","fireball":"7"},{"id":12971,"tstamp":1664760905,"dia":"Domingo","fecha":"10/02/2022 09:35 pm","fijo":"478","corrido":"980","suma":"458","corrido1":"69","corrido2":"80","draw":"Noche","fireball":"6"},{"id":12970,"tstamp":1664731205,"dia":"Domingo","fecha":"10/02/2022 01:20 pm","fijo":"756","corrido":"113","suma":"869","corrido1":"71","corrido2":"13","draw":"Dia","fireball":"8"},{"id":12969,"tstamp":1664674505,"dia":"Sabado","fecha":"10/01/2022 09:35 pm","fijo":"167","corrido":"287","suma":"454","corrido1":"92","corrido2":"87","draw":"Noche","fireball":"4"},{"id":12968,"tstamp":1664644805,"dia":"Sabado","fecha":"10/01/2022 01:20 pm","fijo":"950","corrido":"679","suma":"629","corrido1":"66","corrido2":"79","draw":"Dia","fireball":"9"},{"id":12967,"tstamp":1664588105,"dia":"Viernes","fecha":"09/30/2022 09:35 pm","fijo":"568","corrido":"499","suma":"067","corrido1":"94","corrido2":"99","draw":"Noche","fireball":"0"},{"id":12966,"tstamp":1664558405,"dia":"Viernes","fecha":"09/30/2022 01:20 pm","fijo":"184","corrido":"436","suma":"620","corrido1":"94","corrido2":"36","draw":"Dia","fireball":"0"},{"id":12965,"tstamp":1664501705,"dia":"Jueves","fecha":"09/29/2022 09:35 pm","fijo":"067","corrido":"462","suma":"529","corrido1":"94","corrido2":"62","draw":"Noche","fireball":"8"},{"id":12964,"tstamp":1664472005,"dia":"Jueves","fecha":"09/29/2022 01:20 pm","fijo":"749","corrido":"187","suma":"936","corrido1":"51","corrido2":"87","draw":"Dia","fireball":"2"},{"id":12963,"tstamp":1664415305,"dia":"Miercoles","fecha":"09/28/2022 09:35 pm","fijo":"956","corrido":"512","suma":"468","corrido1":"35","corrido2":"12","draw":"Noche","fireball":"0"},{"id":12962,"tstamp":1664385605,"dia":"Miercoles","fecha":"09/28/2022 01:20 pm","fijo":"248","corrido":"202","suma":"450","corrido1":"32","corrido2":"02","draw":"Dia","fireball":"5"},{"id":12961,"tstamp":1664328905,"dia":"Martes","fecha":"09/27/2022 09:35 pm","fijo":"705","corrido":"239","suma":"944","corrido1":"32","corrido2":"39","draw":"Noche","fireball":"9"},{"id":12960,"tstamp":1664299205,"dia":"Martes","fecha":"09/27/2022 01:20 pm","fijo":"529","corrido":"444","suma":"973","corrido1":"44","corrido2":"44","draw":"Dia","fireball":"9"},{"id":12959,"tstamp":1664242505,"dia":"Lunes","fecha":"09/26/2022 09:35 pm","fijo":"982","corrido":"405","suma":"387","corrido1":"44","corrido2":"05","draw":"Noche","fireball":"5"},{"id":12958,"tstamp":1664212805,"dia":"Lunes","fecha":"09/26/2022 01:20 pm","fijo":"381","corrido":"420","suma":"801","corrido1":"34","corrido2":"20","draw":"Dia","fireball":"9"},{"id":12957,"tstamp":1664156105,"dia":"Domingo","fecha":"09/25/2022 09:35 pm","fijo":"600","corrido":"893","suma":"493","corrido1":"78","corrido2":"93","draw":"Noche","fireball":"2"},{"id":12956,"tstamp":1664126405,"dia":"Domingo","fecha":"09/25/2022 01:20 pm","fijo":"609","corrido":"721","suma":"330","corrido1":"17","corrido2":"21","draw":"Dia","fireball":"2"},{"id":12955,"tstamp":1664069705,"dia":"Sabado","fecha":"09/24/2022 09:35 pm","fijo":"047","corrido":"827","suma":"874","corrido1":"18","corrido2":"27","draw":"Noche","fireball":"0"},{"id":12954,"tstamp":1664040005,"dia":"Sabado","fecha":"09/24/2022 01:20 pm","fijo":"617","corrido":"076","suma":"693","corrido1":"70","corrido2":"76","draw":"Dia","fireball":"8"},{"id":12953,"tstamp":1663983305,"dia":"Viernes","fecha":"09/23/2022 09:35 pm","fijo":"506","corrido":"091","suma":"597","corrido1":"00","corrido2":"91","draw":"Noche","fireball":"4"},{"id":12952,"tstamp":1663953605,"dia":"Viernes","fecha":"09/23/2022 01:20 pm","fijo":"116","corrido":"855","suma":"971","corrido1":"08","corrido2":"55","draw":"Dia","fireball":"4"},{"id":12951,"tstamp":1663896905,"dia":"Jueves","fecha":"09/22/2022 09:35 pm","fijo":"279","corrido":"668","suma":"947","corrido1":"26","corrido2":"68","draw":"Noche","fireball":"5"},{"id":12950,"tstamp":1663867205,"dia":"Jueves","fecha":"09/22/2022 01:20 pm","fijo":"562","corrido":"658","suma":"220","corrido1":"96","corrido2":"58","draw":"Dia","fireball":"2"},{"id":12949,"tstamp":1663810505,"dia":"Miercoles","fecha":"09/21/2022 09:35 pm","fijo":"836","corrido":"464","suma":"300","corrido1":"94","corrido2":"64","draw":"Noche","fireball":"9"},{"id":12948,"tstamp":1663780805,"dia":"Miercoles","fecha":"09/21/2022 01:20 pm","fijo":"043","corrido":"377","suma":"420","corrido1":"33","corrido2":"77","draw":"Dia","fireball":"8"},{"id":12947,"tstamp":1663724105,"dia":"Martes","fecha":"09/20/2022 09:35 pm","fijo":"346","corrido":"351","suma":"697","corrido1":"03","corrido2":"51","draw":"Noche","fireball":"5"},{"id":12946,"tstamp":1663694405,"dia":"Martes","fecha":"09/20/2022 01:20 pm","fijo":"021","corrido":"455","suma":"476","corrido1":"54","corrido2":"55","draw":"Dia","fireball":"5"},{"id":12945,"tstamp":1663637705,"dia":"Lunes","fecha":"09/19/2022 09:35 pm","fijo":"143","corrido":"048","suma":"191","corrido1":"10","corrido2":"48","draw":"Noche","fireball":"0"},{"id":12944,"tstamp":1663608005,"dia":"Lunes","fecha":"09/19/2022 01:20 pm","fijo":"264","corrido":"933","suma":"197","corrido1":"39","corrido2":"33","draw":"Dia","fireball":"8"},{"id":12943,"tstamp":1663551305,"dia":"Domingo","fecha":"09/18/2022 09:35 pm","fijo":"100","corrido":"855","suma":"955","corrido1":"38","corrido2":"55","draw":"Noche","fireball":"4"},{"id":12942,"tstamp":1663521605,"dia":"Domingo","fecha":"09/18/2022 01:20 pm","fijo":"906","corrido":"612","suma":"518","corrido1":"36","corrido2":"12","draw":"Dia","fireball":"3"},{"id":12941,"tstamp":1663464905,"dia":"Sabado","fecha":"09/17/2022 09:35 pm","fijo":"631","corrido":"087","suma":"718","corrido1":"00","corrido2":"87","draw":"Noche","fireball":"2"},{"id":12940,"tstamp":1663435205,"dia":"Sabado","fecha":"09/17/2022 01:20 pm","fijo":"712","corrido":"240","suma":"952","corrido1":"82","corrido2":"40","draw":"Dia","fireball":"8"},{"id":12939,"tstamp":1663378505,"dia":"Viernes","fecha":"09/16/2022 09:35 pm","fijo":"395","corrido":"615","suma":"010","corrido1":"56","corrido2":"15","draw":"Noche","fireball":"3"},{"id":12938,"tstamp":1663348805,"dia":"Viernes","fecha":"09/16/2022 01:20 pm","fijo":"739","corrido":"852","suma":"591","corrido1":"68","corrido2":"52","draw":"Dia","fireball":"7"},{"id":12937,"tstamp":1663292105,"dia":"Jueves","fecha":"09/15/2022 09:35 pm","fijo":"072","corrido":"870","suma":"942","corrido1":"38","corrido2":"70","draw":"Noche","fireball":"9"},{"id":12936,"tstamp":1663262405,"dia":"Jueves","fecha":"09/15/2022 01:20 pm","fijo":"088","corrido":"149","suma":"237","corrido1":"01","corrido2":"49","draw":"Dia","fireball":"6"},{"id":12935,"tstamp":1663205705,"dia":"Miercoles","fecha":"09/14/2022 09:35 pm","fijo":"745","corrido":"399","suma":"144","corrido1":"63","corrido2":"99","draw":"Noche","fireball":"7"},{"id":12934,"tstamp":1663176005,"dia":"Miercoles","fecha":"09/14/2022 01:20 pm","fijo":"861","corrido":"832","suma":"693","corrido1":"88","corrido2":"32","draw":"Dia","fireball":"3"},{"id":12933,"tstamp":1663119305,"dia":"Martes","fecha":"09/13/2022 09:35 pm","fijo":"656","corrido":"938","suma":"594","corrido1":"79","corrido2":"38","draw":"Noche","fireball":"5"},{"id":12932,"tstamp":1663089605,"dia":"Martes","fecha":"09/13/2022 01:20 pm","fijo":"038","corrido":"145","suma":"183","corrido1":"61","corrido2":"45","draw":"Dia","fireball":"6"},{"id":12931,"tstamp":1663032905,"dia":"Lunes","fecha":"09/12/2022 09:35 pm","fijo":"127","corrido":"150","suma":"277","corrido1":"21","corrido2":"50","draw":"Noche","fireball":"5"},{"id":12930,"tstamp":1663003205,"dia":"Lunes","fecha":"09/12/2022 01:20 pm","fijo":"256","corrido":"074","suma":"330","corrido1":"00","corrido2":"74","draw":"Dia","fireball":"0"},{"id":12929,"tstamp":1662946505,"dia":"Domingo","fecha":"09/11/2022 09:35 pm","fijo":"426","corrido":"046","suma":"472","corrido1":"00","corrido2":"46","draw":"Noche","fireball":"4"},{"id":12928,"tstamp":1662916805,"dia":"Domingo","fecha":"09/11/2022 01:20 pm","fijo":"619","corrido":"525","suma":"144","corrido1":"55","corrido2":"25","draw":"Dia","fireball":"8"},{"id":12927,"tstamp":1662860105,"dia":"Sabado","fecha":"09/10/2022 09:35 pm","fijo":"478","corrido":"300","suma":"778","corrido1":"23","corrido2":"00","draw":"Noche","fireball":"7"},{"id":12926,"tstamp":1662830405,"dia":"Sabado","fecha":"09/10/2022 01:20 pm","fijo":"087","corrido":"734","suma":"821","corrido1":"57","corrido2":"34","draw":"Dia","fireball":"7"},{"id":12925,"tstamp":1662773705,"dia":"Viernes","fecha":"09/09/2022 09:35 pm","fijo":"312","corrido":"677","suma":"989","corrido1":"16","corrido2":"77","draw":"Noche","fireball":"7"},{"id":12924,"tstamp":1662744005,"dia":"Viernes","fecha":"09/09/2022 01:20 pm","fijo":"086","corrido":"363","suma":"449","corrido1":"53","corrido2":"63","draw":"Dia","fireball":"4"},{"id":12923,"tstamp":1662687305,"dia":"Jueves","fecha":"09/08/2022 09:35 pm","fijo":"747","corrido":"148","suma":"895","corrido1":"11","corrido2":"48","draw":"Noche","fireball":"6"},{"id":12922,"tstamp":1662657605,"dia":"Jueves","fecha":"09/08/2022 01:20 pm","fijo":"955","corrido":"455","suma":"410","corrido1":"34","corrido2":"55","draw":"Dia","fireball":"8"},{"id":12921,"tstamp":1662600905,"dia":"Miercoles","fecha":"09/07/2022 09:35 pm","fijo":"051","corrido":"702","suma":"753","corrido1":"97","corrido2":"02","draw":"Noche","fireball":"6"},{"id":12920,"tstamp":1662571205,"dia":"Miercoles","fecha":"09/07/2022 01:20 pm","fijo":"162","corrido":"753","suma":"915","corrido1":"87","corrido2":"53","draw":"Dia","fireball":"8"},{"id":12919,"tstamp":1662514505,"dia":"Martes","fecha":"09/06/2022 09:35 pm","fijo":"655","corrido":"958","suma":"613","corrido1":"69","corrido2":"58","draw":"Noche","fireball":"4"},{"id":12918,"tstamp":1662484805,"dia":"Martes","fecha":"09/06/2022 01:20 pm","fijo":"120","corrido":"149","suma":"269","corrido1":"11","corrido2":"49","draw":"Dia","fireball":"5"},{"id":12917,"tstamp":1662428105,"dia":"Lunes","fecha":"09/05/2022 09:35 pm","fijo":"596","corrido":"359","suma":"955","corrido1":"13","corrido2":"59","draw":"Noche","fireball":"2"},{"id":12916,"tstamp":1662398405,"dia":"Lunes","fecha":"09/05/2022 01:20 pm","fijo":"543","corrido":"223","suma":"766","corrido1":"42","corrido2":"23","draw":"Dia","fireball":"4"},{"id":12915,"tstamp":1662341705,"dia":"Domingo","fecha":"09/04/2022 09:35 pm","fijo":"772","corrido":"048","suma":"820","corrido1":"70","corrido2":"48","draw":"Noche","fireball":"0"},{"id":12914,"tstamp":1662312005,"dia":"Domingo","fecha":"09/04/2022 01:20 pm","fijo":"824","corrido":"603","suma":"427","corrido1":"66","corrido2":"03","draw":"Dia","fireball":"7"},{"id":12913,"tstamp":1662255305,"dia":"Sabado","fecha":"09/03/2022 09:35 pm","fijo":"966","corrido":"487","suma":"453","corrido1":"84","corrido2":"87","draw":"Noche","fireball":"1"},{"id":12912,"tstamp":1662225605,"dia":"Sabado","fecha":"09/03/2022 01:20 pm","fijo":"821","corrido":"513","suma":"334","corrido1":"55","corrido2":"13","draw":"Dia","fireball":"2"},{"id":12911,"tstamp":1662168905,"dia":"Viernes","fecha":"09/02/2022 09:35 pm","fijo":"518","corrido":"967","suma":"485","corrido1":"49","corrido2":"67","draw":"Noche","fireball":"7"},{"id":12910,"tstamp":1662139205,"dia":"Viernes","fecha":"09/02/2022 01:20 pm","fijo":"489","corrido":"930","suma":"419","corrido1":"29","corrido2":"30","draw":"Dia","fireball":"4"},{"id":12909,"tstamp":1662082505,"dia":"Jueves","fecha":"09/01/2022 09:35 pm","fijo":"752","corrido":"956","suma":"708","corrido1":"79","corrido2":"56","draw":"Noche","fireball":"6"},{"id":12908,"tstamp":1662052805,"dia":"Jueves","fecha":"09/01/2022 01:20 pm","fijo":"369","corrido":"272","suma":"641","corrido1":"62","corrido2":"72","draw":"Dia","fireball":"8"},{"id":12907,"tstamp":1661996105,"dia":"Miercoles","fecha":"08/31/2022 09:35 pm","fijo":"782","corrido":"768","suma":"550","corrido1":"07","corrido2":"68","draw":"Noche","fireball":"0"},{"id":12906,"tstamp":1661966405,"dia":"Miercoles","fecha":"08/31/2022 01:20 pm","fijo":"689","corrido":"393","suma":"082","corrido1":"33","corrido2":"93","draw":"Dia","fireball":"0"},{"id":12905,"tstamp":1661909705,"dia":"Martes","fecha":"08/30/2022 09:35 pm","fijo":"937","corrido":"374","suma":"311","corrido1":"83","corrido2":"74","draw":"Noche","fireball":"7"},{"id":12904,"tstamp":1661880005,"dia":"Martes","fecha":"08/30/2022 01:20 pm","fijo":"144","corrido":"401","suma":"545","corrido1":"44","corrido2":"01","draw":"Dia","fireball":"7"},{"id":12903,"tstamp":1661823305,"dia":"Lunes","fecha":"08/29/2022 09:35 pm","fijo":"687","corrido":"696","suma":"383","corrido1":"16","corrido2":"96","draw":"Noche","fireball":"2"},{"id":12902,"tstamp":1661793605,"dia":"Lunes","fecha":"08/29/2022 01:20 pm","fijo":"055","corrido":"730","suma":"785","corrido1":"77","corrido2":"30","draw":"Dia","fireball":"4"},{"id":12901,"tstamp":1661736905,"dia":"Domingo","fecha":"08/28/2022 09:35 pm","fijo":"017","corrido":"194","suma":"211","corrido1":"21","corrido2":"94","draw":"Noche","fireball":"5"},{"id":12900,"tstamp":1661707205,"dia":"Domingo","fecha":"08/28/2022 01:20 pm","fijo":"915","corrido":"855","suma":"770","corrido1":"58","corrido2":"55","draw":"Dia","fireball":"2"},{"id":12899,"tstamp":1661650505,"dia":"Sabado","fecha":"08/27/2022 09:35 pm","fijo":"735","corrido":"297","suma":"032","corrido1":"82","corrido2":"97","draw":"Noche","fireball":"4"},{"id":12898,"tstamp":1661620805,"dia":"Sabado","fecha":"08/27/2022 01:20 pm","fijo":"211","corrido":"048","suma":"259","corrido1":"10","corrido2":"48","draw":"Dia","fireball":"9"},{"id":12897,"tstamp":1661564105,"dia":"Viernes","fecha":"08/26/2022 09:35 pm","fijo":"709","corrido":"754","suma":"463","corrido1":"07","corrido2":"54","draw":"Noche","fireball":"9"},{"id":12896,"tstamp":1661534405,"dia":"Viernes","fecha":"08/26/2022 01:20 pm","fijo":"429","corrido":"320","suma":"749","corrido1":"63","corrido2":"20","draw":"Dia","fireball":"4"},{"id":12895,"tstamp":1661477705,"dia":"Jueves","fecha":"08/25/2022 09:35 pm","fijo":"511","corrido":"610","suma":"121","corrido1":"66","corrido2":"10","draw":"Noche","fireball":"8"},{"id":12894,"tstamp":1661448005,"dia":"Jueves","fecha":"08/25/2022 01:20 pm","fijo":"656","corrido":"512","suma":"168","corrido1":"95","corrido2":"12","draw":"Dia","fireball":"5"},{"id":12893,"tstamp":1661391305,"dia":"Miercoles","fecha":"08/24/2022 09:35 pm","fijo":"040","corrido":"550","suma":"590","corrido1":"65","corrido2":"50","draw":"Noche","fireball":"8"},{"id":12892,"tstamp":1661361605,"dia":"Miercoles","fecha":"08/24/2022 01:20 pm","fijo":"472","corrido":"293","suma":"765","corrido1":"42","corrido2":"93","draw":"Dia","fireball":"0"},{"id":12891,"tstamp":1661304905,"dia":"Martes","fecha":"08/23/2022 09:35 pm","fijo":"662","corrido":"401","suma":"063","corrido1":"24","corrido2":"01","draw":"Noche","fireball":"8"},{"id":12890,"tstamp":1661275205,"dia":"Martes","fecha":"08/23/2022 01:20 pm","fijo":"689","corrido":"867","suma":"556","corrido1":"38","corrido2":"67","draw":"Dia","fireball":"6"},{"id":12889,"tstamp":1661218505,"dia":"Lunes","fecha":"08/22/2022 09:35 pm","fijo":"149","corrido":"066","suma":"215","corrido1":"00","corrido2":"66","draw":"Noche","fireball":"9"},{"id":12888,"tstamp":1661188805,"dia":"Lunes","fecha":"08/22/2022 01:20 pm","fijo":"339","corrido":"792","suma":"131","corrido1":"47","corrido2":"92","draw":"Dia","fireball":"5"},{"id":12887,"tstamp":1661132105,"dia":"Domingo","fecha":"08/21/2022 09:35 pm","fijo":"267","corrido":"705","suma":"972","corrido1":"97","corrido2":"05","draw":"Noche","fireball":"1"},{"id":12886,"tstamp":1661102405,"dia":"Domingo","fecha":"08/21/2022 01:20 pm","fijo":"050","corrido":"817","suma":"867","corrido1":"58","corrido2":"17","draw":"Dia","fireball":"7"},{"id":12885,"tstamp":1661045705,"dia":"Sabado","fecha":"08/20/2022 09:35 pm","fijo":"410","corrido":"082","suma":"492","corrido1":"30","corrido2":"82","draw":"Noche","fireball":"0"},{"id":12884,"tstamp":1661016005,"dia":"Sabado","fecha":"08/20/2022 01:20 pm","fijo":"992","corrido":"280","suma":"272","corrido1":"22","corrido2":"80","draw":"Dia","fireball":"1"},{"id":12883,"tstamp":1660959305,"dia":"Viernes","fecha":"08/19/2022 09:35 pm","fijo":"677","corrido":"361","suma":"038","corrido1":"03","corrido2":"61","draw":"Noche","fireball":"3"},{"id":12882,"tstamp":1660929605,"dia":"Viernes","fecha":"08/19/2022 01:20 pm","fijo":"858","corrido":"110","suma":"968","corrido1":"91","corrido2":"10","draw":"Dia","fireball":"8"},{"id":12881,"tstamp":1660872905,"dia":"Jueves","fecha":"08/18/2022 09:35 pm","fijo":"536","corrido":"244","suma":"780","corrido1":"72","corrido2":"44","draw":"Noche","fireball":"7"},{"id":12880,"tstamp":1660843205,"dia":"Jueves","fecha":"08/18/2022 01:20 pm","fijo":"474","corrido":"453","suma":"927","corrido1":"24","corrido2":"53","draw":"Dia","fireball":"5"},{"id":12879,"tstamp":1660786505,"dia":"Miercoles","fecha":"08/17/2022 09:35 pm","fijo":"019","corrido":"243","suma":"262","corrido1":"12","corrido2":"43","draw":"Noche","fireball":"7"},{"id":12878,"tstamp":1660756805,"dia":"Miercoles","fecha":"08/17/2022 01:20 pm","fijo":"410","corrido":"420","suma":"830","corrido1":"64","corrido2":"20","draw":"Dia","fireball":"5"},{"id":12877,"tstamp":1660700105,"dia":"Martes","fecha":"08/16/2022 09:35 pm","fijo":"237","corrido":"133","suma":"370","corrido1":"01","corrido2":"33","draw":"Noche","fireball":"3"},{"id":12876,"tstamp":1660670405,"dia":"Martes","fecha":"08/16/2022 01:20 pm","fijo":"797","corrido":"951","suma":"748","corrido1":"59","corrido2":"51","draw":"Dia","fireball":"3"},{"id":12875,"tstamp":1660613705,"dia":"Lunes","fecha":"08/15/2022 09:35 pm","fijo":"394","corrido":"675","suma":"069","corrido1":"16","corrido2":"75","draw":"Noche","fireball":"9"},{"id":12874,"tstamp":1660584005,"dia":"Lunes","fecha":"08/15/2022 01:20 pm","fijo":"902","corrido":"656","suma":"558","corrido1":"66","corrido2":"56","draw":"Dia","fireball":"9"},{"id":12873,"tstamp":1660527305,"dia":"Domingo","fecha":"08/14/2022 09:35 pm","fijo":"420","corrido":"109","suma":"529","corrido1":"31","corrido2":"09","draw":"Noche","fireball":"1"},{"id":12872,"tstamp":1660497605,"dia":"Domingo","fecha":"08/14/2022 01:20 pm","fijo":"359","corrido":"719","suma":"078","corrido1":"97","corrido2":"19","draw":"Dia","fireball":"7"},{"id":12871,"tstamp":1660440905,"dia":"Sabado","fecha":"08/13/2022 09:35 pm","fijo":"475","corrido":"999","suma":"474","corrido1":"19","corrido2":"99","draw":"Noche","fireball":"4"},{"id":12870,"tstamp":1660411205,"dia":"Sabado","fecha":"08/13/2022 01:20 pm","fijo":"099","corrido":"411","suma":"510","corrido1":"64","corrido2":"11","draw":"Dia","fireball":"3"},{"id":12869,"tstamp":1660354505,"dia":"Viernes","fecha":"08/12/2022 09:35 pm","fijo":"848","corrido":"572","suma":"420","corrido1":"05","corrido2":"72","draw":"Noche","fireball":"9"},{"id":12868,"tstamp":1660324805,"dia":"Viernes","fecha":"08/12/2022 01:20 pm","fijo":"099","corrido":"580","suma":"679","corrido1":"05","corrido2":"80","draw":"Dia","fireball":"1"},{"id":12867,"tstamp":1660268105,"dia":"Jueves","fecha":"08/11/2022 09:35 pm","fijo":"867","corrido":"604","suma":"471","corrido1":"56","corrido2":"04","draw":"Noche","fireball":"0"},{"id":12866,"tstamp":1660238405,"dia":"Jueves","fecha":"08/11/2022 01:20 pm","fijo":"545","corrido":"828","suma":"373","corrido1":"18","corrido2":"28","draw":"Dia","fireball":"4"},{"id":12865,"tstamp":1660181705,"dia":"Miercoles","fecha":"08/10/2022 09:35 pm","fijo":"418","corrido":"656","suma":"074","corrido1":"06","corrido2":"56","draw":"Noche","fireball":"7"},{"id":12864,"tstamp":1660152005,"dia":"Miercoles","fecha":"08/10/2022 01:20 pm","fijo":"398","corrido":"497","suma":"895","corrido1":"14","corrido2":"97","draw":"Dia","fireball":"1"},{"id":12863,"tstamp":1660095305,"dia":"Martes","fecha":"08/09/2022 09:35 pm","fijo":"433","corrido":"527","suma":"960","corrido1":"45","corrido2":"27","draw":"Noche","fireball":"9"},{"id":12862,"tstamp":1660065605,"dia":"Martes","fecha":"08/09/2022 01:20 pm","fijo":"316","corrido":"884","suma":"200","corrido1":"58","corrido2":"84","draw":"Dia","fireball":"2"},{"id":12861,"tstamp":1660008905,"dia":"Lunes","fecha":"08/08/2022 09:35 pm","fijo":"561","corrido":"014","suma":"575","corrido1":"60","corrido2":"14","draw":"Noche","fireball":"3"},{"id":12860,"tstamp":1659979205,"dia":"Lunes","fecha":"08/08/2022 01:20 pm","fijo":"890","corrido":"573","suma":"463","corrido1":"75","corrido2":"73","draw":"Dia","fireball":"9"},{"id":12859,"tstamp":1659922505,"dia":"Domingo","fecha":"08/07/2022 09:35 pm","fijo":"459","corrido":"037","suma":"496","corrido1":"20","corrido2":"37","draw":"Noche","fireball":"1"},{"id":12858,"tstamp":1659892805,"dia":"Domingo","fecha":"08/07/2022 01:20 pm","fijo":"843","corrido":"585","suma":"428","corrido1":"55","corrido2":"85","draw":"Dia","fireball":"6"},{"id":12857,"tstamp":1659836105,"dia":"Sabado","fecha":"08/06/2022 09:35 pm","fijo":"499","corrido":"352","suma":"851","corrido1":"23","corrido2":"52","draw":"Noche","fireball":"3"},{"id":12856,"tstamp":1659806405,"dia":"Sabado","fecha":"08/06/2022 01:20 pm","fijo":"592","corrido":"753","suma":"345","corrido1":"47","corrido2":"53","draw":"Dia","fireball":"7"},{"id":12855,"tstamp":1659749705,"dia":"Viernes","fecha":"08/05/2022 09:35 pm","fijo":"076","corrido":"920","suma":"996","corrido1":"09","corrido2":"20","draw":"Noche","fireball":"2"},{"id":12854,"tstamp":1659720005,"dia":"Viernes","fecha":"08/05/2022 01:20 pm","fijo":"910","corrido":"705","suma":"615","corrido1":"97","corrido2":"05","draw":"Dia","fireball":"6"},{"id":12853,"tstamp":1659663305,"dia":"Jueves","fecha":"08/04/2022 09:35 pm","fijo":"593","corrido":"488","suma":"081","corrido1":"74","corrido2":"88","draw":"Noche","fireball":"0"},{"id":12852,"tstamp":1659633605,"dia":"Jueves","fecha":"08/04/2022 01:20 pm","fijo":"190","corrido":"752","suma":"942","corrido1":"47","corrido2":"52","draw":"Dia","fireball":"2"},{"id":12851,"tstamp":1659576905,"dia":"Miercoles","fecha":"08/03/2022 09:35 pm","fijo":"045","corrido":"901","suma":"946","corrido1":"49","corrido2":"01","draw":"Noche","fireball":"9"},{"id":12850,"tstamp":1659547205,"dia":"Miercoles","fecha":"08/03/2022 01:20 pm","fijo":"328","corrido":"986","suma":"314","corrido1":"29","corrido2":"86","draw":"Dia","fireball":"3"},{"id":12849,"tstamp":1659490505,"dia":"Martes","fecha":"08/02/2022 09:35 pm","fijo":"034","corrido":"007","suma":"41","corrido1":"00","corrido2":"07","draw":"Noche","fireball":"1"},{"id":12848,"tstamp":1659460805,"dia":"Martes","fecha":"08/02/2022 01:20 pm","fijo":"195","corrido":"592","suma":"787","corrido1":"85","corrido2":"92","draw":"Dia","fireball":"9"},{"id":12847,"tstamp":1659404105,"dia":"Lunes","fecha":"08/01/2022 09:35 pm","fijo":"332","corrido":"636","suma":"968","corrido1":"46","corrido2":"36","draw":"Noche","fireball":"1"},{"id":12846,"tstamp":1659374405,"dia":"Lunes","fecha":"08/01/2022 01:20 pm","fijo":"505","corrido":"485","suma":"990","corrido1":"84","corrido2":"85","draw":"Dia","fireball":"2"},{"id":12845,"tstamp":1659317705,"dia":"Domingo","fecha":"07/31/2022 09:35 pm","fijo":"458","corrido":"196","suma":"654","corrido1":"31","corrido2":"96","draw":"Noche","fireball":"5"},{"id":12844,"tstamp":1659288005,"dia":"Domingo","fecha":"07/31/2022 01:20 pm","fijo":"695","corrido":"852","suma":"547","corrido1":"08","corrido2":"52","draw":"Dia","fireball":"1"},{"id":12843,"tstamp":1659231305,"dia":"Sabado","fecha":"07/30/2022 09:35 pm","fijo":"646","corrido":"362","suma":"008","corrido1":"93","corrido2":"62","draw":"Noche","fireball":"6"},{"id":12842,"tstamp":1659201605,"dia":"Sabado","fecha":"07/30/2022 01:20 pm","fijo":"540","corrido":"518","suma":"058","corrido1":"15","corrido2":"18","draw":"Dia","fireball":"5"},{"id":12841,"tstamp":1659144905,"dia":"Viernes","fecha":"07/29/2022 09:35 pm","fijo":"425","corrido":"273","suma":"698","corrido1":"52","corrido2":"73","draw":"Noche","fireball":"8"},{"id":12840,"tstamp":1659115205,"dia":"Viernes","fecha":"07/29/2022 01:20 pm","fijo":"741","corrido":"759","suma":"500","corrido1":"57","corrido2":"59","draw":"Dia","fireball":"1"},{"id":12839,"tstamp":1659058505,"dia":"Jueves","fecha":"07/28/2022 09:35 pm","fijo":"974","corrido":"646","suma":"620","corrido1":"16","corrido2":"46","draw":"Noche","fireball":"9"},{"id":12838,"tstamp":1659028805,"dia":"Jueves","fecha":"07/28/2022 01:20 pm","fijo":"903","corrido":"319","suma":"222","corrido1":"13","corrido2":"19","draw":"Dia","fireball":"8"},{"id":12837,"tstamp":1658972105,"dia":"Miercoles","fecha":"07/27/2022 09:35 pm","fijo":"354","corrido":"025","suma":"379","corrido1":"70","corrido2":"25","draw":"Noche","fireball":"4"},{"id":12836,"tstamp":1658942405,"dia":"Miercoles","fecha":"07/27/2022 01:20 pm","fijo":"428","corrido":"004","suma":"432","corrido1":"90","corrido2":"04","draw":"Dia","fireball":"3"},{"id":12835,"tstamp":1658885705,"dia":"Martes","fecha":"07/26/2022 09:35 pm","fijo":"299","corrido":"416","suma":"715","corrido1":"04","corrido2":"16","draw":"Noche","fireball":"1"},{"id":12834,"tstamp":1658856005,"dia":"Martes","fecha":"07/26/2022 01:20 pm","fijo":"389","corrido":"618","suma":"007","corrido1":"96","corrido2":"18","draw":"Dia","fireball":"5"},{"id":12833,"tstamp":1658799305,"dia":"Lunes","fecha":"07/25/2022 09:35 pm","fijo":"479","corrido":"554","suma":"033","corrido1":"35","corrido2":"54","draw":"Noche","fireball":"5"},{"id":12832,"tstamp":1658769605,"dia":"Lunes","fecha":"07/25/2022 01:20 pm","fijo":"204","corrido":"363","suma":"567","corrido1":"13","corrido2":"63","draw":"Dia","fireball":"5"},{"id":12831,"tstamp":1658712905,"dia":"Domingo","fecha":"07/24/2022 09:35 pm","fijo":"970","corrido":"687","suma":"657","corrido1":"56","corrido2":"87","draw":"Noche","fireball":"2"},{"id":12830,"tstamp":1658683205,"dia":"Domingo","fecha":"07/24/2022 01:20 pm","fijo":"842","corrido":"588","suma":"430","corrido1":"25","corrido2":"88","draw":"Dia","fireball":"3"},{"id":12829,"tstamp":1658626505,"dia":"Sabado","fecha":"07/23/2022 09:35 pm","fijo":"164","corrido":"850","suma":"014","corrido1":"88","corrido2":"50","draw":"Noche","fireball":"4"},{"id":12828,"tstamp":1658596805,"dia":"Sabado","fecha":"07/23/2022 01:20 pm","fijo":"813","corrido":"897","suma":"710","corrido1":"48","corrido2":"97","draw":"Dia","fireball":"5"},{"id":12827,"tstamp":1658540105,"dia":"Viernes","fecha":"07/22/2022 09:35 pm","fijo":"260","corrido":"786","suma":"046","corrido1":"87","corrido2":"86","draw":"Noche","fireball":"7"},{"id":12826,"tstamp":1658510405,"dia":"Viernes","fecha":"07/22/2022 01:20 pm","fijo":"320","corrido":"984","suma":"304","corrido1":"19","corrido2":"84","draw":"Dia","fireball":"4"},{"id":12825,"tstamp":1658453705,"dia":"Jueves","fecha":"07/21/2022 09:35 pm","fijo":"754","corrido":"846","suma":"600","corrido1":"08","corrido2":"46","draw":"Noche","fireball":"1"},{"id":12824,"tstamp":1658424005,"dia":"Jueves","fecha":"07/21/2022 01:20 pm","fijo":"734","corrido":"877","suma":"611","corrido1":"48","corrido2":"77","draw":"Dia","fireball":"0"},{"id":12823,"tstamp":1658367305,"dia":"Miercoles","fecha":"07/20/2022 09:35 pm","fijo":"974","corrido":"635","suma":"609","corrido1":"26","corrido2":"35","draw":"Noche","fireball":"2"},{"id":12822,"tstamp":1658337605,"dia":"Miercoles","fecha":"07/20/2022 01:20 pm","fijo":"896","corrido":"467","suma":"363","corrido1":"34","corrido2":"67","draw":"Dia","fireball":"2"},{"id":12821,"tstamp":1658280905,"dia":"Martes","fecha":"07/19/2022 09:35 pm","fijo":"210","corrido":"831","suma":"041","corrido1":"88","corrido2":"31","draw":"Noche","fireball":"4"},{"id":12820,"tstamp":1658251205,"dia":"Martes","fecha":"07/19/2022 01:20 pm","fijo":"562","corrido":"593","suma":"155","corrido1":"05","corrido2":"93","draw":"Dia","fireball":"5"},{"id":12819,"tstamp":1658194505,"dia":"Lunes","fecha":"07/18/2022 09:35 pm","fijo":"778","corrido":"356","suma":"134","corrido1":"23","corrido2":"56","draw":"Noche","fireball":"5"},{"id":12818,"tstamp":1658164805,"dia":"Lunes","fecha":"07/18/2022 01:20 pm","fijo":"865","corrido":"158","suma":"023","corrido1":"71","corrido2":"58","draw":"Dia","fireball":"8"},{"id":12817,"tstamp":1658108105,"dia":"Domingo","fecha":"07/17/2022 09:35 pm","fijo":"040","corrido":"803","suma":"843","corrido1":"28","corrido2":"03","draw":"Noche","fireball":"5"},{"id":12816,"tstamp":1658078405,"dia":"Domingo","fecha":"07/17/2022 01:20 pm","fijo":"559","corrido":"689","suma":"248","corrido1":"36","corrido2":"89","draw":"Dia","fireball":"3"},{"id":12815,"tstamp":1658021705,"dia":"Sabado","fecha":"07/16/2022 09:35 pm","fijo":"707","corrido":"939","suma":"646","corrido1":"39","corrido2":"39","draw":"Noche","fireball":"9"},{"id":12814,"tstamp":1657992005,"dia":"Sabado","fecha":"07/16/2022 01:20 pm","fijo":"066","corrido":"759","suma":"825","corrido1":"67","corrido2":"59","draw":"Dia","fireball":"9"},{"id":12813,"tstamp":1657935305,"dia":"Viernes","fecha":"07/15/2022 09:35 pm","fijo":"944","corrido":"112","suma":"056","corrido1":"91","corrido2":"12","draw":"Noche","fireball":"1"},{"id":12812,"tstamp":1657905605,"dia":"Viernes","fecha":"07/15/2022 01:20 pm","fijo":"492","corrido":"886","suma":"378","corrido1":"18","corrido2":"86","draw":"Dia","fireball":"7"},{"id":12811,"tstamp":1657848905,"dia":"Jueves","fecha":"07/14/2022 09:35 pm","fijo":"261","corrido":"440","suma":"701","corrido1":"84","corrido2":"40","draw":"Noche","fireball":"7"},{"id":12810,"tstamp":1657819205,"dia":"Jueves","fecha":"07/14/2022 01:20 pm","fijo":"851","corrido":"103","suma":"954","corrido1":"81","corrido2":"03","draw":"Dia","fireball":"9"},{"id":12809,"tstamp":1657762505,"dia":"Miercoles","fecha":"07/13/2022 09:35 pm","fijo":"139","corrido":"051","suma":"190","corrido1":"70","corrido2":"51","draw":"Noche","fireball":"5"},{"id":12808,"tstamp":1657732805,"dia":"Miercoles","fecha":"07/13/2022 01:20 pm","fijo":"770","corrido":"601","suma":"371","corrido1":"36","corrido2":"01","draw":"Dia","fireball":"4"},{"id":12807,"tstamp":1657676105,"dia":"Martes","fecha":"07/12/2022 09:35 pm","fijo":"101","corrido":"982","suma":"083","corrido1":"09","corrido2":"82","draw":"Noche","fireball":"2"},{"id":12806,"tstamp":1657646405,"dia":"Martes","fecha":"07/12/2022 01:20 pm","fijo":"366","corrido":"916","suma":"282","corrido1":"69","corrido2":"16","draw":"Dia","fireball":"2"},{"id":12805,"tstamp":1657589705,"dia":"Lunes","fecha":"07/11/2022 09:35 pm","fijo":"498","corrido":"114","suma":"612","corrido1":"01","corrido2":"14","draw":"Noche","fireball":"0"},{"id":12804,"tstamp":1657560005,"dia":"Lunes","fecha":"07/11/2022 01:20 pm","fijo":"434","corrido":"793","suma":"227","corrido1":"27","corrido2":"93","draw":"Dia","fireball":"2"},{"id":12803,"tstamp":1657503305,"dia":"Domingo","fecha":"07/10/2022 09:35 pm","fijo":"334","corrido":"921","suma":"255","corrido1":"09","corrido2":"21","draw":"Noche","fireball":"9"},{"id":12802,"tstamp":1657473605,"dia":"Domingo","fecha":"07/10/2022 01:20 pm","fijo":"344","corrido":"246","suma":"590","corrido1":"52","corrido2":"46","draw":"Dia","fireball":"0"},{"id":12801,"tstamp":1657416905,"dia":"Sabado","fecha":"07/09/2022 09:35 pm","fijo":"150","corrido":"625","suma":"775","corrido1":"36","corrido2":"25","draw":"Noche","fireball":"6"},{"id":12800,"tstamp":1657387205,"dia":"Sabado","fecha":"07/09/2022 01:20 pm","fijo":"049","corrido":"906","suma":"955","corrido1":"39","corrido2":"06","draw":"Dia","fireball":"8"},{"id":12799,"tstamp":1657330505,"dia":"Viernes","fecha":"07/08/2022 09:35 pm","fijo":"880","corrido":"053","suma":"933","corrido1":"40","corrido2":"53","draw":"Noche","fireball":"6"},{"id":12798,"tstamp":1657300805,"dia":"Viernes","fecha":"07/08/2022 01:20 pm","fijo":"123","corrido":"303","suma":"426","corrido1":"43","corrido2":"03","draw":"Dia","fireball":"1"},{"id":12797,"tstamp":1657244105,"dia":"Jueves","fecha":"07/07/2022 09:35 pm","fijo":"678","corrido":"298","suma":"976","corrido1":"82","corrido2":"98","draw":"Noche","fireball":"4"},{"id":12796,"tstamp":1657214405,"dia":"Jueves","fecha":"07/07/2022 01:20 pm","fijo":"453","corrido":"350","suma":"803","corrido1":"43","corrido2":"50","draw":"Dia","fireball":"3"},{"id":12795,"tstamp":1657157705,"dia":"Miercoles","fecha":"07/06/2022 09:35 pm","fijo":"521","corrido":"671","suma":"192","corrido1":"46","corrido2":"71","draw":"Noche","fireball":"4"},{"id":12794,"tstamp":1657128005,"dia":"Miercoles","fecha":"07/06/2022 01:20 pm","fijo":"315","corrido":"480","suma":"795","corrido1":"94","corrido2":"80","draw":"Dia","fireball":"4"},{"id":12793,"tstamp":1657071305,"dia":"Martes","fecha":"07/05/2022 09:35 pm","fijo":"673","corrido":"809","suma":"482","corrido1":"98","corrido2":"09","draw":"Noche","fireball":"9"},{"id":12792,"tstamp":1657041605,"dia":"Martes","fecha":"07/05/2022 01:20 pm","fijo":"560","corrido":"715","suma":"275","corrido1":"67","corrido2":"15","draw":"Dia","fireball":"6"},{"id":12791,"tstamp":1656984905,"dia":"Lunes","fecha":"07/04/2022 09:35 pm","fijo":"070","corrido":"347","suma":"417","corrido1":"93","corrido2":"47","draw":"Noche","fireball":"2"},{"id":12790,"tstamp":1656955205,"dia":"Lunes","fecha":"07/04/2022 01:20 pm","fijo":"077","corrido":"723","suma":"800","corrido1":"07","corrido2":"23","draw":"Dia","fireball":"7"},{"id":12789,"tstamp":1656898505,"dia":"Domingo","fecha":"07/03/2022 09:35 pm","fijo":"991","corrido":"897","suma":"888","corrido1":"88","corrido2":"97","draw":"Noche","fireball":"9"},{"id":12788,"tstamp":1656868805,"dia":"Domingo","fecha":"07/03/2022 01:20 pm","fijo":"032","corrido":"446","suma":"478","corrido1":"04","corrido2":"46","draw":"Dia","fireball":"6"},{"id":12787,"tstamp":1656812105,"dia":"Sabado","fecha":"07/02/2022 09:35 pm","fijo":"379","corrido":"527","suma":"906","corrido1":"55","corrido2":"27","draw":"Noche","fireball":"7"},{"id":12786,"tstamp":1656782405,"dia":"Sabado","fecha":"07/02/2022 01:20 pm","fijo":"293","corrido":"972","suma":"265","corrido1":"99","corrido2":"72","draw":"Dia","fireball":"2"},{"id":12785,"tstamp":1656725705,"dia":"Viernes","fecha":"07/01/2022 09:35 pm","fijo":"503","corrido":"662","suma":"165","corrido1":"86","corrido2":"62","draw":"Noche","fireball":"7"},{"id":12784,"tstamp":1656696005,"dia":"Viernes","fecha":"07/01/2022 01:20 pm","fijo":"823","corrido":"461","suma":"284","corrido1":"54","corrido2":"61","draw":"Dia","fireball":"9"},{"id":12783,"tstamp":1656639305,"dia":"Jueves","fecha":"06/30/2022 09:35 pm","fijo":"206","corrido":"640","suma":"846","corrido1":"16","corrido2":"40","draw":"Noche","fireball":"7"},{"id":12782,"tstamp":1656609605,"dia":"Jueves","fecha":"06/30/2022 01:20 pm","fijo":"118","corrido":"531","suma":"649","corrido1":"55","corrido2":"31","draw":"Dia","fireball":"3"},{"id":12781,"tstamp":1656552905,"dia":"Miercoles","fecha":"06/29/2022 09:35 pm","fijo":"893","corrido":"477","suma":"370","corrido1":"34","corrido2":"77","draw":"Noche","fireball":"6"},{"id":12780,"tstamp":1656523205,"dia":"Miercoles","fecha":"06/29/2022 01:20 pm","fijo":"371","corrido":"577","suma":"948","corrido1":"05","corrido2":"77","draw":"Dia","fireball":"6"},{"id":12779,"tstamp":1656466505,"dia":"Martes","fecha":"06/28/2022 09:35 pm","fijo":"043","corrido":"785","suma":"828","corrido1":"37","corrido2":"85","draw":"Noche","fireball":"5"},{"id":12778,"tstamp":1656436805,"dia":"Martes","fecha":"06/28/2022 01:20 pm","fijo":"046","corrido":"217","suma":"263","corrido1":"82","corrido2":"17","draw":"Dia","fireball":"9"},{"id":12777,"tstamp":1656380105,"dia":"Lunes","fecha":"06/27/2022 09:35 pm","fijo":"293","corrido":"340","suma":"633","corrido1":"73","corrido2":"40","draw":"Noche","fireball":"1"},{"id":12776,"tstamp":1656350405,"dia":"Lunes","fecha":"06/27/2022 01:20 pm","fijo":"228","corrido":"086","suma":"314","corrido1":"00","corrido2":"86","draw":"Dia","fireball":"2"},{"id":12775,"tstamp":1656293705,"dia":"Domingo","fecha":"06/26/2022 09:35 pm","fijo":"706","corrido":"951","suma":"657","corrido1":"09","corrido2":"51","draw":"Noche","fireball":"9"},{"id":12774,"tstamp":1656264005,"dia":"Domingo","fecha":"06/26/2022 01:20 pm","fijo":"082","corrido":"794","suma":"876","corrido1":"97","corrido2":"94","draw":"Dia","fireball":"4"},{"id":12773,"tstamp":1656207305,"dia":"Sabado","fecha":"06/25/2022 09:35 pm","fijo":"700","corrido":"744","suma":"444","corrido1":"17","corrido2":"44","draw":"Noche","fireball":"6"},{"id":12772,"tstamp":1656177605,"dia":"Sabado","fecha":"06/25/2022 01:20 pm","fijo":"150","corrido":"815","suma":"965","corrido1":"48","corrido2":"15","draw":"Dia","fireball":"3"},{"id":12771,"tstamp":1656120905,"dia":"Viernes","fecha":"06/24/2022 09:35 pm","fijo":"515","corrido":"573","suma":"088","corrido1":"75","corrido2":"73","draw":"Noche","fireball":"9"},{"id":12770,"tstamp":1656091205,"dia":"Viernes","fecha":"06/24/2022 01:20 pm","fijo":"621","corrido":"011","suma":"632","corrido1":"30","corrido2":"11","draw":"Dia","fireball":"3"},{"id":12769,"tstamp":1656034505,"dia":"Jueves","fecha":"06/23/2022 09:35 pm","fijo":"148","corrido":"920","suma":"068","corrido1":"39","corrido2":"20","draw":"Noche","fireball":"1"},{"id":12768,"tstamp":1656004805,"dia":"Jueves","fecha":"06/23/2022 01:20 pm","fijo":"086","corrido":"651","suma":"737","corrido1":"86","corrido2":"51","draw":"Dia","fireball":"6"},{"id":12767,"tstamp":1655948105,"dia":"Miercoles","fecha":"06/22/2022 09:35 pm","fijo":"005","corrido":"600","suma":"605","corrido1":"16","corrido2":"00","draw":"Noche","fireball":"7"},{"id":12766,"tstamp":1655918405,"dia":"Miercoles","fecha":"06/22/2022 01:20 pm","fijo":"957","corrido":"996","suma":"953","corrido1":"89","corrido2":"96","draw":"Dia","fireball":"5"},{"id":12765,"tstamp":1655861705,"dia":"Martes","fecha":"06/21/2022 09:35 pm","fijo":"628","corrido":"392","suma":"020","corrido1":"83","corrido2":"92","draw":"Noche","fireball":"8"},{"id":12764,"tstamp":1655832005,"dia":"Martes","fecha":"06/21/2022 01:20 pm","fijo":"275","corrido":"508","suma":"783","corrido1":"15","corrido2":"08","draw":"Dia","fireball":"5"},{"id":12763,"tstamp":1655775305,"dia":"Lunes","fecha":"06/20/2022 09:35 pm","fijo":"126","corrido":"269","suma":"395","corrido1":"82","corrido2":"69","draw":"Noche","fireball":"4"},{"id":12762,"tstamp":1655745605,"dia":"Lunes","fecha":"06/20/2022 01:20 pm","fijo":"952","corrido":"571","suma":"523","corrido1":"05","corrido2":"71","draw":"Dia","fireball":"5"},{"id":12761,"tstamp":1655688905,"dia":"Domingo","fecha":"06/19/2022 09:35 pm","fijo":"668","corrido":"591","suma":"259","corrido1":"15","corrido2":"91","draw":"Noche","fireball":"5"},{"id":12760,"tstamp":1655659205,"dia":"Domingo","fecha":"06/19/2022 01:20 pm","fijo":"573","corrido":"269","suma":"842","corrido1":"22","corrido2":"69","draw":"Dia","fireball":"8"},{"id":12759,"tstamp":1655602505,"dia":"Sabado","fecha":"06/18/2022 09:35 pm","fijo":"938","corrido":"225","suma":"163","corrido1":"02","corrido2":"25","draw":"Noche","fireball":"8"},{"id":12758,"tstamp":1655572805,"dia":"Sabado","fecha":"06/18/2022 01:20 pm","fijo":"929","corrido":"185","suma":"114","corrido1":"41","corrido2":"85","draw":"Dia","fireball":"3"},{"id":12757,"tstamp":1655516105,"dia":"Viernes","fecha":"06/17/2022 09:35 pm","fijo":"279","corrido":"000","suma":"279","corrido1":"20","corrido2":"00","draw":"Noche","fireball":"6"},{"id":12756,"tstamp":1655486405,"dia":"Viernes","fecha":"06/17/2022 01:20 pm","fijo":"971","corrido":"856","suma":"827","corrido1":"58","corrido2":"56","draw":"Dia","fireball":"5"},{"id":12755,"tstamp":1655429705,"dia":"Jueves","fecha":"06/16/2022 09:35 pm","fijo":"598","corrido":"758","suma":"356","corrido1":"37","corrido2":"58","draw":"Noche","fireball":"9"},{"id":12754,"tstamp":1655400005,"dia":"Jueves","fecha":"06/16/2022 01:20 pm","fijo":"815","corrido":"074","suma":"889","corrido1":"60","corrido2":"74","draw":"Dia","fireball":"3"},{"id":12753,"tstamp":1655343305,"dia":"Miercoles","fecha":"06/15/2022 09:35 pm","fijo":"796","corrido":"574","suma":"370","corrido1":"55","corrido2":"74","draw":"Noche","fireball":"8"},{"id":12752,"tstamp":1655313605,"dia":"Miercoles","fecha":"06/15/2022 01:20 pm","fijo":"463","corrido":"240","suma":"703","corrido1":"02","corrido2":"40","draw":"Dia","fireball":"0"},{"id":12751,"tstamp":1655256905,"dia":"Martes","fecha":"06/14/2022 09:35 pm","fijo":"371","corrido":"846","suma":"217","corrido1":"58","corrido2":"46","draw":"Noche","fireball":"4"},{"id":12750,"tstamp":1655227205,"dia":"Martes","fecha":"06/14/2022 01:20 pm","fijo":"548","corrido":"669","suma":"217","corrido1":"16","corrido2":"69","draw":"Dia","fireball":"9"},{"id":12749,"tstamp":1655170505,"dia":"Lunes","fecha":"06/13/2022 09:35 pm","fijo":"738","corrido":"754","suma":"492","corrido1":"67","corrido2":"54","draw":"Noche","fireball":"0"},{"id":12748,"tstamp":1655140805,"dia":"Lunes","fecha":"06/13/2022 01:20 pm","fijo":"529","corrido":"748","suma":"277","corrido1":"77","corrido2":"48","draw":"Dia","fireball":"6"},{"id":12747,"tstamp":1655084105,"dia":"Domingo","fecha":"06/12/2022 09:35 pm","fijo":"872","corrido":"758","suma":"630","corrido1":"17","corrido2":"58","draw":"Noche","fireball":"0"},{"id":12746,"tstamp":1655054405,"dia":"Domingo","fecha":"06/12/2022 01:20 pm","fijo":"579","corrido":"376","suma":"955","corrido1":"23","corrido2":"76","draw":"Dia","fireball":"5"},{"id":12745,"tstamp":1654997705,"dia":"Sabado","fecha":"06/11/2022 09:35 pm","fijo":"072","corrido":"703","suma":"775","corrido1":"87","corrido2":"03","draw":"Noche","fireball":"3"},{"id":12744,"tstamp":1654968005,"dia":"Sabado","fecha":"06/11/2022 01:20 pm","fijo":"612","corrido":"350","suma":"962","corrido1":"13","corrido2":"50","draw":"Dia","fireball":"3"},{"id":12743,"tstamp":1654911305,"dia":"Viernes","fecha":"06/10/2022 09:35 pm","fijo":"856","corrido":"039","suma":"895","corrido1":"30","corrido2":"39","draw":"Noche","fireball":"3"},{"id":12742,"tstamp":1654881605,"dia":"Viernes","fecha":"06/10/2022 01:20 pm","fijo":"252","corrido":"982","suma":"234","corrido1":"29","corrido2":"82","draw":"Dia","fireball":"1"},{"id":12741,"tstamp":1654824905,"dia":"Jueves","fecha":"06/09/2022 09:35 pm","fijo":"497","corrido":"267","suma":"764","corrido1":"62","corrido2":"67","draw":"Noche","fireball":"9"},{"id":12740,"tstamp":1654795205,"dia":"Jueves","fecha":"06/09/2022 01:20 pm","fijo":"526","corrido":"848","suma":"374","corrido1":"68","corrido2":"48","draw":"Dia","fireball":"5"},{"id":12739,"tstamp":1654738505,"dia":"Miercoles","fecha":"06/08/2022 09:35 pm","fijo":"680","corrido":"680","suma":"360","corrido1":"36","corrido2":"80","draw":"Noche","fireball":"1"},{"id":12738,"tstamp":1654708805,"dia":"Miercoles","fecha":"06/08/2022 01:20 pm","fijo":"935","corrido":"484","suma":"419","corrido1":"04","corrido2":"84","draw":"Dia","fireball":"8"},{"id":12737,"tstamp":1654652105,"dia":"Martes","fecha":"06/07/2022 09:35 pm","fijo":"444","corrido":"136","suma":"580","corrido1":"01","corrido2":"36","draw":"Noche","fireball":"5"},{"id":12736,"tstamp":1654622405,"dia":"Martes","fecha":"06/07/2022 01:20 pm","fijo":"956","corrido":"571","suma":"527","corrido1":"95","corrido2":"71","draw":"Dia","fireball":"7"},{"id":12735,"tstamp":1654565705,"dia":"Lunes","fecha":"06/06/2022 09:35 pm","fijo":"343","corrido":"436","suma":"779","corrido1":"24","corrido2":"36","draw":"Noche","fireball":"0"},{"id":12734,"tstamp":1654536005,"dia":"Lunes","fecha":"06/06/2022 01:20 pm","fijo":"243","corrido":"633","suma":"876","corrido1":"06","corrido2":"33","draw":"Dia","fireball":"2"},{"id":12733,"tstamp":1654479305,"dia":"Domingo","fecha":"06/05/2022 09:35 pm","fijo":"774","corrido":"175","suma":"949","corrido1":"31","corrido2":"75","draw":"Noche","fireball":"0"},{"id":12732,"tstamp":1654449605,"dia":"Domingo","fecha":"06/05/2022 01:20 pm","fijo":"892","corrido":"482","suma":"374","corrido1":"24","corrido2":"82","draw":"Dia","fireball":"8"},{"id":12731,"tstamp":1654392905,"dia":"Sabado","fecha":"06/04/2022 09:35 pm","fijo":"208","corrido":"380","suma":"588","corrido1":"13","corrido2":"80","draw":"Noche","fireball":"4"},{"id":12730,"tstamp":1654363205,"dia":"Sabado","fecha":"06/04/2022 01:20 pm","fijo":"265","corrido":"559","suma":"824","corrido1":"35","corrido2":"59","draw":"Dia","fireball":"2"},{"id":12729,"tstamp":1654306505,"dia":"Viernes","fecha":"06/03/2022 09:35 pm","fijo":"012","corrido":"972","suma":"984","corrido1":"69","corrido2":"72","draw":"Noche","fireball":"6"},{"id":12728,"tstamp":1654276805,"dia":"Viernes","fecha":"06/03/2022 01:20 pm","fijo":"680","corrido":"428","suma":"108","corrido1":"34","corrido2":"28","draw":"Dia","fireball":"2"},{"id":12727,"tstamp":1654220105,"dia":"Jueves","fecha":"06/02/2022 09:35 pm","fijo":"675","corrido":"170","suma":"845","corrido1":"41","corrido2":"70","draw":"Noche","fireball":"5"},{"id":12726,"tstamp":1654190405,"dia":"Jueves","fecha":"06/02/2022 01:20 pm","fijo":"125","corrido":"377","suma":"502","corrido1":"03","corrido2":"77","draw":"Dia","fireball":"9"},{"id":12725,"tstamp":1654133705,"dia":"Miercoles","fecha":"06/01/2022 09:35 pm","fijo":"331","corrido":"025","suma":"356","corrido1":"20","corrido2":"25","draw":"Noche","fireball":"9"},{"id":12724,"tstamp":1654104005,"dia":"Miercoles","fecha":"06/01/2022 01:20 pm","fijo":"846","corrido":"603","suma":"449","corrido1":"56","corrido2":"03","draw":"Dia","fireball":"3"},{"id":12723,"tstamp":1654047305,"dia":"Martes","fecha":"05/31/2022 09:35 pm","fijo":"726","corrido":"267","suma":"993","corrido1":"22","corrido2":"67","draw":"Noche","fireball":"5"},{"id":12722,"tstamp":1654017605,"dia":"Martes","fecha":"05/31/2022 01:20 pm","fijo":"398","corrido":"138","suma":"536","corrido1":"31","corrido2":"38","draw":"Dia","fireball":"7"},{"id":12721,"tstamp":1653960905,"dia":"Lunes","fecha":"05/30/2022 09:35 pm","fijo":"821","corrido":"651","suma":"472","corrido1":"56","corrido2":"51","draw":"Noche","fireball":"9"},{"id":12720,"tstamp":1653931205,"dia":"Lunes","fecha":"05/30/2022 01:20 pm","fijo":"499","corrido":"301","suma":"800","corrido1":"93","corrido2":"01","draw":"Dia","fireball":"4"},{"id":12719,"tstamp":1653874505,"dia":"Domingo","fecha":"05/29/2022 09:35 pm","fijo":"400","corrido":"787","suma":"187","corrido1":"17","corrido2":"87","draw":"Noche","fireball":"1"},{"id":12718,"tstamp":1653844805,"dia":"Domingo","fecha":"05/29/2022 01:20 pm","fijo":"454","corrido":"893","suma":"347","corrido1":"08","corrido2":"93","draw":"Dia","fireball":"6"},{"id":12717,"tstamp":1653788105,"dia":"Sabado","fecha":"05/28/2022 09:35 pm","fijo":"697","corrido":"110","suma":"807","corrido1":"51","corrido2":"10","draw":"Noche","fireball":"4"},{"id":12716,"tstamp":1653758405,"dia":"Sabado","fecha":"05/28/2022 01:20 pm","fijo":"514","corrido":"197","suma":"711","corrido1":"71","corrido2":"97","draw":"Dia","fireball":"3"},{"id":12715,"tstamp":1653701705,"dia":"Viernes","fecha":"05/27/2022 09:35 pm","fijo":"138","corrido":"255","suma":"393","corrido1":"72","corrido2":"55","draw":"Noche","fireball":"0"},{"id":12714,"tstamp":1653672005,"dia":"Viernes","fecha":"05/27/2022 01:20 pm","fijo":"044","corrido":"247","suma":"291","corrido1":"02","corrido2":"47","draw":"Dia","fireball":"4"},{"id":12713,"tstamp":1653615305,"dia":"Jueves","fecha":"05/26/2022 09:35 pm","fijo":"534","corrido":"276","suma":"810","corrido1":"22","corrido2":"76","draw":"Noche","fireball":"8"},{"id":12712,"tstamp":1653585605,"dia":"Jueves","fecha":"05/26/2022 01:20 pm","fijo":"532","corrido":"340","suma":"872","corrido1":"53","corrido2":"40","draw":"Dia","fireball":"9"},{"id":12711,"tstamp":1653528905,"dia":"Miercoles","fecha":"05/25/2022 09:35 pm","fijo":"680","corrido":"361","suma":"041","corrido1":"23","corrido2":"61","draw":"Noche","fireball":"9"},{"id":12710,"tstamp":1653499205,"dia":"Miercoles","fecha":"05/25/2022 01:20 pm","fijo":"942","corrido":"223","suma":"165","corrido1":"62","corrido2":"23","draw":"Dia","fireball":"0"},{"id":12709,"tstamp":1653442505,"dia":"Martes","fecha":"05/24/2022 09:35 pm","fijo":"592","corrido":"354","suma":"946","corrido1":"23","corrido2":"54","draw":"Noche","fireball":"0"},{"id":12708,"tstamp":1653412805,"dia":"Martes","fecha":"05/24/2022 01:20 pm","fijo":"659","corrido":"203","suma":"862","corrido1":"22","corrido2":"03","draw":"Dia","fireball":"2"},{"id":12707,"tstamp":1653356105,"dia":"Lunes","fecha":"05/23/2022 09:35 pm","fijo":"418","corrido":"811","suma":"229","corrido1":"08","corrido2":"11","draw":"Noche","fireball":"7"},{"id":12706,"tstamp":1653326405,"dia":"Lunes","fecha":"05/23/2022 01:20 pm","fijo":"309","corrido":"794","suma":"103","corrido1":"97","corrido2":"94","draw":"Dia","fireball":"2"},{"id":12705,"tstamp":1653269705,"dia":"Domingo","fecha":"05/22/2022 09:35 pm","fijo":"536","corrido":"700","suma":"236","corrido1":"77","corrido2":"00","draw":"Noche","fireball":"6"},{"id":12704,"tstamp":1653240005,"dia":"Domingo","fecha":"05/22/2022 01:20 pm","fijo":"010","corrido":"152","suma":"162","corrido1":"81","corrido2":"52","draw":"Dia","fireball":"2"},{"id":12703,"tstamp":1653183305,"dia":"Sabado","fecha":"05/21/2022 09:35 pm","fijo":"786","corrido":"896","suma":"682","corrido1":"28","corrido2":"96","draw":"Noche","fireball":"4"},{"id":12702,"tstamp":1653153605,"dia":"Sabado","fecha":"05/21/2022 01:20 pm","fijo":"413","corrido":"161","suma":"574","corrido1":"71","corrido2":"61","draw":"Dia","fireball":"3"},{"id":12701,"tstamp":1653096905,"dia":"Viernes","fecha":"05/20/2022 09:35 pm","fijo":"718","corrido":"373","suma":"091","corrido1":"33","corrido2":"73","draw":"Noche","fireball":"6"},{"id":12700,"tstamp":1653067205,"dia":"Viernes","fecha":"05/20/2022 01:20 pm","fijo":"532","corrido":"161","suma":"693","corrido1":"51","corrido2":"61","draw":"Dia","fireball":"6"},{"id":12699,"tstamp":1653010505,"dia":"Jueves","fecha":"05/19/2022 09:35 pm","fijo":"496","corrido":"370","suma":"866","corrido1":"13","corrido2":"70","draw":"Noche","fireball":"3"},{"id":12698,"tstamp":1652980805,"dia":"Jueves","fecha":"05/19/2022 01:20 pm","fijo":"376","corrido":"819","suma":"195","corrido1":"08","corrido2":"19","draw":"Dia","fireball":"0"},{"id":12697,"tstamp":1652924105,"dia":"Miercoles","fecha":"05/18/2022 09:35 pm","fijo":"373","corrido":"006","suma":"379","corrido1":"10","corrido2":"06","draw":"Noche","fireball":"1"},{"id":12696,"tstamp":1652894405,"dia":"Miercoles","fecha":"05/18/2022 01:20 pm","fijo":"978","corrido":"708","suma":"686","corrido1":"67","corrido2":"08","draw":"Dia","fireball":"0"},{"id":12695,"tstamp":1652837705,"dia":"Martes","fecha":"05/17/2022 09:35 pm","fijo":"682","corrido":"808","suma":"490","corrido1":"48","corrido2":"08","draw":"Noche","fireball":"0"},{"id":12694,"tstamp":1652808005,"dia":"Martes","fecha":"05/17/2022 01:20 pm","fijo":"650","corrido":"602","suma":"252","corrido1":"66","corrido2":"02","draw":"Dia","fireball":"6"},{"id":12693,"tstamp":1652751305,"dia":"Lunes","fecha":"05/16/2022 09:35 pm","fijo":"706","corrido":"369","suma":"075","corrido1":"53","corrido2":"69","draw":"Noche","fireball":"3"},{"id":12692,"tstamp":1652721605,"dia":"Lunes","fecha":"05/16/2022 01:20 pm","fijo":"376","corrido":"719","suma":"095","corrido1":"77","corrido2":"19","draw":"Dia","fireball":"5"},{"id":12691,"tstamp":1652664905,"dia":"Domingo","fecha":"05/15/2022 09:35 pm","fijo":"417","corrido":"241","su